stories_id,publish_date,title,url,language,ap_syndicated,themes,media_id,media_name,media_url
"1867801004","2021-03-02 11:27:16","President Biden’s nominees for financial regulators face congressional scrutiny.","https://www.nytimes.com/live/2021/03/02/business/stock-market-today/president-bidens-nominees-for-financial-regulators-face-congressional-scrutiny","en","False","politics and government, finances, united states politics and government, appointments and executive changes, banks and banking, stocks and bonds","1","New York Times","http://nytimes.com"
"1867800970","2021-03-02 11:14:48","Biden’s cabinet picks are being confirmed at a steady clip as Tanden’s tweets draw fire.","https://www.nytimes.com/live/2021/03/02/us/joe-biden-news/bidens-cabinet-picks-are-being-confirmed-at-a-steady-clip-as-tandens-tweets-draw-fire","en","False","politics and government, law and legislation, finances, united states politics and government, budgets and budgeting, medicine and health, labor","1","New York Times","http://nytimes.com"
"1867971191","2021-03-02 14:57:29","An interim leader was appointed for the U.S. attorney’s office in Washington.","https://www.nytimes.com/live/2021/03/02/us/joe-biden-news/an-interim-leader-was-appointed-for-the-us-attorneys-office-in-washington","en","False","politics and government, united states politics and government, elections, terrorism, crime and criminals","1","New York Times","http://nytimes.com"
"1868001170","2021-03-02 15:30:47","Gina Raimondo, the governor of Rhode Island, is confirmed as commerce secretary.","https://www.nytimes.com/live/2021/03/02/us/joe-biden-news/gina-raimondo-the-governor-of-rhode-island-is-confirmed-as-commerce-secretary","en","False","politics and government, united states politics and government, appointments and executive changes, oil (petroleum) and gasoline","1","New York Times","http://nytimes.com"
"1868081099","2021-03-02 17:24:17","Biden’s Picks for Financial Regulator Jobs Emphasize Transparency and Fairness","https://www.nytimes.com/2021/03/02/business/sec-cfpb-gensler-chopra-hearing.html","en","False","","1","New York Times","http://nytimes.com"
"1868317424","2021-03-03 00:03:03","U.S. Infrastructure Earns a C– Ahead of a Biden Investment Plan","https://www.nytimes.com/2021/03/03/business/infrastructure-grade.html","en","False","finances, budgets and budgeting","1","New York Times","http://nytimes.com"
"1868592428","2021-03-03 06:19:12","Wisconsin Hunters Kill Over 200 Wolves in Less Than 3 Days","https://www.nytimes.com/2021/03/03/us/wisconsin-wolves-killings.html","en","False","murders and attempted murders, animals, hunting and trapping, endangered and extinct species","1","New York Times","http://nytimes.com"
"1868663881","2021-03-03 07:21:41","Vernon Jordan Is Remembered as a Power Broker","https://www.nytimes.com/2021/03/03/business/dealbook/vernon-jordan-dead.html","en","False","politics and government, finances, labor, blacks, lobbying and lobbyists, ethics, biographical information, deaths (obituaries)","1","New York Times","http://nytimes.com"
"1868663877","2021-03-03 07:30:06","Exxon Mobil’s Chief Says It Is ‘Supportive’ of Zero-Emission Goals","https://www.nytimes.com/2021/03/03/business/energy-environment/exxon-mobil-darren-woods.html","en","False","oil (petroleum) and gasoline, global warming, environment, weather, energy and power, air pollution, electric light and power, light","1","New York Times","http://nytimes.com"
"1868947778","2021-03-03 12:14:18","Rising dress sales at Urban Outfitters’ brands could signal a return to socializing.","https://www.nytimes.com/live/2021/03/03/business/stock-market-today/rising-dress-sales-at-urban-outfitters-brands-could-signal-a-return-to-socializing","en","False","finances, economic conditions and trends","1","New York Times","http://nytimes.com"
"1869058550","2021-03-03 14:14:21","A ‘Rent’ Reunion Measures 25 Years of Love and Loss","https://www.nytimes.com/2021/03/03/theater/rent-25-year-reunion-concert.html","en","False","","1","New York Times","http://nytimes.com"
"1869058537","2021-03-03 14:23:22","A Small Hint of Big Trouble in the Oceans","https://www.nytimes.com/2021/03/03/climate/a-small-hint-of-big-trouble-in-the-oceans.html","en","False","weather, hurricanes and tropical storms","1","New York Times","http://nytimes.com"
"1869149320","2021-03-03 16:14:08","Wyoming Coal Country Pivots, Reluctantly,  to Wind Farms","https://www.nytimes.com/2021/03/03/climate/wyoming-coal-country-wind-farm.html","en","False","politics and government, united states politics and government, global warming, environment, editorials, energy and power, air pollution, electric light and power, light","1","New York Times","http://nytimes.com"
"1869168585","2021-03-03 16:55:36","Blinken Proposes a Foreign Policy Not ‘Disconnected From Our Daily Lives’","https://www.nytimes.com/2021/03/03/us/politics/biden-blinken-foreign-policy.html","en","False","politics and government, united states politics and government, medicine and health, united states international relations, international relations, economic conditions and trends","1","New York Times","http://nytimes.com"
"1869200132","2021-03-03 18:00:42","Reopening, Stimulus, Wildlife Cameras: Your Wednesday Evening Briefing","https://www.nytimes.com/2021/03/03/briefing/reopening-stimulus-wildlife-cameras.html","en","False","politics and government, medicine and health, terrorism, diseases and conditions","1","New York Times","http://nytimes.com"
"1869234261","2021-03-03 18:51:25","Catch up: Facebook lifts ban on political ads.","https://www.nytimes.com/live/2021/02/26/business/stock-market-today/catch-up-facebook-lifts-ban-on-political-ads","en","False","computers and the internet, finances, suits and litigation, stocks and bonds, futures and options trading, securities and commodities violations, brokers and brokerage firms","1","New York Times","http://nytimes.com"
"1869631258","2021-03-04 05:00:08","Making the Concrete and Steel We Need Doesn’t Have to Bake the Planet","https://www.nytimes.com/2021/03/04/opinion/climate-change-infrastructure.html","en","False","politics and government, labor, global warming, environment, editorials, weather, air pollution, water","1","New York Times","http://nytimes.com"
"1869631256","2021-03-04 05:00:09","In California, Berkeley Beat Back NIMBYs","https://www.nytimes.com/2021/03/04/opinion/affordable-housing-california.html","en","False","","1","New York Times","http://nytimes.com"
"1870012916","2021-03-04 12:26:47","Fixing What the Internet Broke","https://www.nytimes.com/2021/03/04/technology/internet-election-misinformation.html","en","False","politics and government, computers and the internet, united states politics and government, elections, frauds and swindling","1","New York Times","http://nytimes.com"
"1870078136","2021-03-04 13:09:10","What Students Are Saying About Supporting Struggling Students, Connecting With Their Heritage and Hidden Truths","https://www.nytimes.com/2021/03/04/learning/what-students-are-saying-about-supporting-struggling-students-connecting-with-their-heritage-and-hidden-truths.html","en","False","advertising and marketing, oil (petroleum) and gasoline, global warming, environment, air pollution","1","New York Times","http://nytimes.com"
"1870235632","2021-03-04 17:01:42","Gap sales highlight divergence between stores and the internet in the pandemic.","https://www.nytimes.com/live/2021/03/04/business/stock-market-today/gap-sales-highlight-divergence-between-stores-and-the-internet-in-the-pandemic","en","False","finances, stocks and bonds, credit","1","New York Times","http://nytimes.com"
"1870272943","2021-03-04 18:30:44","Vaccinations, Senate Clerks, Myanmar: Your Thursday Evening Briefing","https://www.nytimes.com/2021/03/04/briefing/vaccinations-senate-clerks-myanmar.html","en","False","politics and government, finances, medicine and health, diseases and conditions, vaccination and immunization","1","New York Times","http://nytimes.com"
"1870540583","2021-03-05 03:00:09","The Promises to Coal Country Are Familiar, but Can Biden Deliver?","https://www.nytimes.com/2021/03/05/us/kentucky-coal-biden.html","en","False","finances","1","New York Times","http://nytimes.com"
"1870727469","2021-03-05 06:26:14","Voting Rights or the Filibuster?","https://www.nytimes.com/2021/03/05/briefing/cuomo-nursing-homes-harry-meghan-interview-stimulus-bill.html","en","False","politics and government, law and legislation, united states politics and government, elections, frauds and swindling","1","New York Times","http://nytimes.com"
"1870911681","2021-03-05 10:00:05","After decades of familiar promises, coal communities remain skeptical about Biden’s vows.","https://www.nytimes.com/live/2021/03/05/us/joe-biden-news/after-decades-of-familiar-promises-coal-communities-remain-skeptical-about-bidens-vows","en","False","politics and government, finances, budgets and budgeting, medicine and health, labor, editorials, unemployment, economic conditions and trends","1","New York Times","http://nytimes.com"
"1870911678","2021-03-05 10:00:07","'Judas and the Black Messiah' Is the Latest Film to Punt on Politics","https://www.nytimes.com/2021/03/05/movies/judas-and-the-black-messiah-politics.html","en","False","motion pictures, reviews, documentary films and programs","1","New York Times","http://nytimes.com"
"1871001403","2021-03-05 12:13:45","Plan to Rebuild Louisiana’s Vanishing Coast Moves Ahead","https://www.nytimes.com/2021/03/05/climate/louisiana-mississippi-river-diversion.html","en","False","oil (petroleum) and gasoline, environment, hurricanes and tropical storms, fish and other marine life, water, water pollution","1","New York Times","http://nytimes.com"
"1871761772","2021-03-06 11:00:05","The Episode That Roiled Smith College","https://www.nytimes.com/2021/03/06/opinion/letters/smith-college-race-class.html","en","False","education and schools, colleges and universities, blacks, discrimination","1","New York Times","http://nytimes.com"
"1872273458","2021-03-07 05:00:17","For Planet Earth, No Tourism is a Curse and a Blessing","https://www.nytimes.com/2021/03/07/travel/covid-pandemic-environmental-impact.html","en","False","","1","New York Times","http://nytimes.com"
"1872334758","2021-03-07 07:00:04","The Week in Business: Jobs Are Coming Back","https://www.nytimes.com/2021/03/07/business/week-in-business-jobs.html","en","False","politics and government, law and legislation, finances, labor, wages and salaries","1","New York Times","http://nytimes.com"
"1872459651","2021-03-07 11:00:06","U.S. Military Power, and the Lessons of History","https://www.nytimes.com/2021/03/07/opinion/letters/afghanistan-united-states.html","en","False","politics and government, united states politics and government, armament, defense and military forces, united states armament and defense, united states international relations, international relations","1","New York Times","http://nytimes.com"
"1872584902","2021-03-07 15:23:24","Mexico Set to Reshape Power Sector to Favor the State","https://www.nytimes.com/2021/03/07/world/americas/mexico-energy-sector-privatization.html","en","False","","1","New York Times","http://nytimes.com"
"1872675885","2021-03-07 18:31:58","MacKenzie Scott, a Philanthropist and Ex-Wife of Jeff Bezos, Remarries","https://www.nytimes.com/2021/03/07/business/mackenzie-scott-dan-jewett.html","en","False","computers and the internet, books and literature, philanthropy","1","New York Times","http://nytimes.com"
"1872789397","2021-03-07 23:30:02","Word of the Day: bequeath","https://www.nytimes.com/2021/03/07/learning/word-of-the-day-bequeath.html","en","False","land use policies","1","New York Times","http://nytimes.com"
"1872977511","2021-03-08 05:00:19","Oil Giants Prepare to Put Carbon Back in the Ground","https://www.nytimes.com/2021/03/08/business/carbon-capture-bp.html","en","False","oil (petroleum) and gasoline, environment, energy and power, air pollution","1","New York Times","http://nytimes.com"
"1872976122","2021-03-08 05:00:11","Biden to Sign Executive Order to Advance Gender Equity","https://www.nytimes.com/2021/03/08/us/gender-policy-council-biden.html","en","False","politics and government, united states politics and government, medicine and health, women, united states international relations, international relations, economic conditions and trends","1","New York Times","http://nytimes.com"
"1873121942","2021-03-08 07:54:20","Chamath Palihapitiya Faces Questions About a Big Stock Sale","https://www.nytimes.com/2021/03/08/business/dealbook/chamath-palihapitiya-spac.html","en","False","finances, stocks and bonds, mergers, acquisitions and divestitures","1","New York Times","http://nytimes.com"
"1873275626","2021-03-08 09:28:35","How Coronavirus Has Changed New York City Transit, in One Chart","https://www.nytimes.com/interactive/2021/03/08/climate/nyc-transit-covid.html","en","False","","1","New York Times","http://nytimes.com"
"1873281571","2021-03-08 11:04:22","Global Warming’s Deadly Combination: Heat and Humidity","https://www.nytimes.com/2021/03/08/climate/climate-change-heat-tropics.html","en","False","medicine and health, global warming, environment, weather, air pollution, research, chemistry","1","New York Times","http://nytimes.com"
"1873627112","2021-03-08 19:00:10","Will Stagnation Follow the Biden Boom?","https://www.nytimes.com/2021/03/08/opinion/biden-economy-stagnation.html","en","False","politics and government, law and legislation, finances, medicine and health, diseases and conditions, economic conditions and trends, vaccination and immunization","1","New York Times","http://nytimes.com"
"1873951271","2021-03-09 05:00:11","Why Japan Is Holding Back as the World Rushes Toward Electric Cars","https://www.nytimes.com/2021/03/09/business/electric-cars-japan.html","en","False","finances, automobiles","1","New York Times","http://nytimes.com"
"1874038351","2021-03-09 06:47:50","Bitcoin's Climate Change Impact Is Under Scrutiny","https://www.nytimes.com/2021/03/09/business/dealbook/bitcoin-climate-change.html","en","False","","1","New York Times","http://nytimes.com"
"1874089787","2021-03-09 07:32:58","BP and other oil giants are betting big on being able to bury pollutants under the ocean.","https://www.nytimes.com/live/2021/03/09/business/stock-market-today/bp-and-other-oil-giants-are-betting-big-on-being-able-to-bury-pollutants-under-the-ocean","en","False","finances, medicine and health, diseases and conditions, economic conditions and trends, vaccination and immunization","1","New York Times","http://nytimes.com"
"1874451170","2021-02-17 00:00:00","Burst Pipes and Power Outages in Battered Texas - The New York Times","https://www.nytimes.com/live/2021/02/17/us/winter-storm-weather-live","en","False","","1","New York Times","http://nytimes.com"
"1874553018","2021-02-11 11:26:31","Shell Says Its Oil Production Has Peaked and Is Likely to Decline - The New York Times","https://www.nytimes.com/2021/02/11/business/shell-oil-production.html?searchResultPosition=1","en","False","finances, oil (petroleum) and gasoline, production","1","New York Times","http://nytimes.com"
"1874564992","2021-03-03 03:00:06","In the Atlantic Ocean, Subtle Shifts Hint at Dramatic Dangers - The New York Times","https://www.nytimes.com/interactive/2021/03/02/climate/atlantic-ocean-climate-change.html?mbid=&utm_source=nl&utm_brand=tny&utm_mailing=TNY_ClimateCrisis_030321&utm_campaign=aud-dev&utm_medium=email&bxid=5bd671582ddf9c6194390808&cndid=24429293&hasha=8553458c979fa3dc43014b8d2290d07c&hashb=6c485a75875abc8f000fcf9b6ab65172263efd75&hashc=79373707362128e568a3192a706c8c84d92139dead868b5a195bce3cfbee016e&esrc=&utm_term=TNY_ClimateCrisis","en","False","","1","New York Times","http://nytimes.com"
"1874573389","2021-02-02 16:41:46","US Cities Are Vastly Undercounting Greenhouse Gas Emissions, Researchers Find - The New York Times","https://www.nytimes.com/2021/02/02/climate/cities-greenhouse-gas-emissions.html?mc_cid=0357c5139b&mc_eid=227f80dd28","en","False","","1","New York Times","http://nytimes.com"
"1874584725","2021-03-09 17:57:57","For Chuck Schumer, a Dream Job Comes With Tall Orders","https://www.nytimes.com/2021/03/09/us/politics/chuck-schumer-senate-majority-leader.html","en","False","","1","New York Times","http://nytimes.com"
"1874610064","2021-02-17 21:15:31","What Caused the Blackouts in Texas? - The New York Times","https://www.nytimes.com/2021/02/17/climate/texas-blackouts-disinformation.html?action=click&module=Spotlight&pgtype=Homepage","en","False","global warming, environment, editorials, weather, hurricanes and tropical storms, energy and power, air pollution, electric light and power, light, blackouts and brownouts (electrical)","1","New York Times","http://nytimes.com"
"1874626623","2021-02-18 13:39:08","Why Is It So Cold in the United States? - The New York Times","https://www.nytimes.com/interactive/2021/02/17/climate/winter-storm-climate-change.html","en","False","global warming, weather, research","1","New York Times","http://nytimes.com"
"1874922818","2021-03-10 04:00:04","Lesson of the Day: ‘2 Days, 10 Dogs, 150 Miles in the Wilderness: This Is the Iditarod for Teens’","https://www.nytimes.com/2021/03/10/learning/lesson-of-the-day-2-days-10-dogs-150-miles-in-the-wilderness-this-is-the-iditarod-for-teens.html","en","False","","1","New York Times","http://nytimes.com"
"1874922801","2021-03-10 04:20:43","The Mayor’s House Was Bombed. The Message: Keep Our Town Nuclear-Free.","https://www.nytimes.com/2021/03/10/business/japan-fukushima-nuclear-waste.html","en","False","politics and government, environment, electric light and power, light, atomic energy","1","New York Times","http://nytimes.com"
"1874990921","2021-03-10 05:00:16","Do You Really Need to Fly?","https://www.nytimes.com/2021/03/10/opinion/business-travel-videoconferencing.html","en","False","computers and the internet, finances, medicine and health","1","New York Times","http://nytimes.com"
"1875135288","2021-03-10 08:00:34","Lina Khan Would Bring a Tough Antitrust Voice","https://www.nytimes.com/2021/03/10/business/dealbook/lina-khan-antitrust.html","en","False","politics and government, law and legislation, finances, labor","1","New York Times","http://nytimes.com"
"1875215225","2021-03-10 09:30:14","House Hunting in Mexico: A 19th-Century Courthouse Turned Hacienda","https://www.nytimes.com/2021/03/10/realestate/la-paz-mexico-house-hunting.html","en","False","finances, prices (fares, fees and rates), travel and vacations, housing, condominiums","1","New York Times","http://nytimes.com"
"1875303640","2021-03-10 11:20:31","Crowded N.Y.C. Jails Stoke Covid Fears: ‘It’s a Ticking Time Bomb’","https://www.nytimes.com/2021/03/10/nyregion/nyc-jail-covid.html","en","False","medicine and health, terrorism, diseases and conditions, prisons and prisoners","1","New York Times","http://nytimes.com"
"1875340777","2021-03-10 11:24:59","Reluctantly, a Coal State Pivots to Wind","https://www.nytimes.com/2021/03/10/climate/nyt-climate-newsletter-coal.html","en","False","environment, energy and power, electric light and power, light, atomic energy","1","New York Times","http://nytimes.com"
"1875442931","2021-03-10 13:34:27","Blinken will meet China’s foreign minister in Alaska next week.","https://www.nytimes.com/live/2021/03/10/us/joe-biden-news/blinken-will-meet-chinas-foreign-minister-in-alaska-next-week","en","False","politics and government, law and legislation, finances, united states politics and government, budgets and budgeting, labor","1","New York Times","http://nytimes.com"
"1875538438","2021-03-10 15:31:03","Leaving Afghanistan Now Would Be a Mistake","https://www.nytimes.com/2021/03/10/opinion/letters/afghanistan-united-states.html","en","False","politics and government, united states politics and government, armament, defense and military forces, terrorism, crime and criminals, united states armament and defense, united states international relations, international relations, airlines and airplanes, world trade center (nyc), office buildings and commercial properties, hijacking","1","New York Times","http://nytimes.com"
"1875552521","2021-03-10 16:10:48","What Can Biden’s Plan Do for Poverty? Look to Bangladesh.","https://www.nytimes.com/2021/03/10/opinion/biden-child-poverty-bangladesh.html","en","False","politics and government","1","New York Times","http://nytimes.com"
"1875610219","2021-03-10 17:37:18","Two Emerging Designers Who Find Comfort in Antiquity","https://www.nytimes.com/2021/03/10/t-magazine/emerging-design-furniture.html","en","False","apparel, home furnishings, biographical information, architecture, interior design","1","New York Times","http://nytimes.com"
"1875627756","2021-03-10 18:03:54","U.S. Aims to Deter Dangerous Travel by Central American Children","https://www.nytimes.com/video/us/politics/100000007647689/central-america-children-biden.html","en","False","","1","New York Times","http://nytimes.com"
"1875627751","2021-03-10 18:20:36","The Senate has confirmed Michael Regan to lead the E.P.A.","https://www.nytimes.com/live/2021/03/10/us/joe-biden-news/michael-regan-biden-epa","en","False","politics and government, finances, united states politics and government, environment","1","New York Times","http://nytimes.com"
"1875627747","2021-03-10 18:08:04","Senate Confirms Biden’s Pick to Lead E.P.A.","https://www.nytimes.com/2021/03/10/climate/senate-confirms-bidens-pick-to-lead-epa.html","en","False","","1","New York Times","http://nytimes.com"
"1875647656","2021-03-10 18:48:10","Blinken Will Meet Chinese Officials After Asia Tour Next Week","https://www.nytimes.com/2021/03/10/us/politics/blinken-china-korea-japan.html","en","False","politics and government, united states politics and government, armament, defense and military forces, united states armament and defense, united states international relations, international relations","1","New York Times","http://nytimes.com"
"1876068706","2021-03-11 05:00:15","When Your West Wing Job Is Really, Really Far From the Oval Office","https://www.nytimes.com/2021/03/11/us/politics/remote-work-white-house.html","en","False","politics and government","1","New York Times","http://nytimes.com"
"1876068684","2021-03-11 05:51:32","As Oil Prices Rise, Executives Aim to Keep Them High","https://www.nytimes.com/2021/03/11/business/energy-environment/oil-prices-opec-shale.html","en","False","finances, oil (petroleum) and gasoline, international trade and world market, economic conditions and trends, united states economy, prices (fares, fees and rates), energy and power","1","New York Times","http://nytimes.com"
"1876328681","2021-03-11 11:09:25","Some West Wing jobs these days are really far from the Oval Office.","https://www.nytimes.com/live/2021/03/11/us/joe-biden-news/some-west-wing-jobs-these-days-are-really-far-from-the-oval-office","en","False","medicine and health, diseases and conditions","1","New York Times","http://nytimes.com"
"1876390569","2021-03-11 12:19:02","European Central Bank to Step Up Stimulus to Keep Borrowing Costs Low","https://www.nytimes.com/2021/03/11/business/european-central-bank-bond-buying.html","en","False","finances, recession and depression, banks and banking, economic conditions and trends, united states economy, prices (fares, fees and rates), stocks and bonds, credit, interest rates, government bonds","1","New York Times","http://nytimes.com"
"1876453062","2021-03-11 13:52:44","There’s a Global Plan to Conserve Nature. Indigenous People Could Lead the Way.","https://www.nytimes.com/2021/03/11/climate/nature-conservation-30-percent.html","en","False","","1","New York Times","http://nytimes.com"
"1876480314","2021-03-11 14:27:52","Your Friday Briefing","https://www.nytimes.com/2021/03/11/briefing/myanmar-astrazeneca-hongkong.html","en","False","politics and government, no index terms from nytimes, demonstrations and riots","1","New York Times","http://nytimes.com"
"1876497428","2021-03-11 14:29:42","How Can Blackness Construct America?","https://www.nytimes.com/2021/03/11/arts/design/black-architecture-moma.html","en","False","art, reviews, trade shows and fairs","1","New York Times","http://nytimes.com"
"1876648161","2021-03-11 18:45:52","Can Democrats Still Count on the Grass-Roots?","https://www.nytimes.com/2021/03/11/us/politics/democratic-fundraising.html","en","False","politics and government, computers and the internet, finances, united states politics and government, advertising and marketing, elections, presidents and presidency (us), presidential elections (us), public opinion, ethics","1","New York Times","http://nytimes.com"
"1876648145","2021-03-11 18:51:06","Book Review: ‘Hunt, Gather, Parent,’ by Michaeleen Doucleff","https://www.nytimes.com/2021/03/11/books/review/hunt-gather-parent-michaeleen-doucleff.html","en","False","books and literature, medicine and health, reviews","1","New York Times","http://nytimes.com"
"1876980706","2021-03-12 05:00:07","Taylor Swift Is Bringing Us Back to Nature","https://www.nytimes.com/2021/03/12/opinion/taylor-swift-grammys-nature-lyrics.html","en","False","","1","New York Times","http://nytimes.com"
"1877246685","2021-03-12 08:59:30","What to Know Now About the Newsom Recall Effort","https://www.nytimes.com/2021/03/12/us/ca-newsom-recall.html","en","False","education and schools, politics and government, medicine and health, labor, referendums","1","New York Times","http://nytimes.com"
"1877488900","2021-03-12 15:04:46","A survey of Republicans shows 5 factions have emerged following Trump’s presidency.","https://www.nytimes.com/live/2021/03/12/us/joe-biden-news/a-survey-of-republicans-shows-5-factions-have-emerged-following-trumps-presidency","en","False","politics and government, law and legislation, finances, united states politics and government, medicine and health","1","New York Times","http://nytimes.com"
