stories_id,publish_date,title,url,language,ap_syndicated,themes,media_id,media_name,media_url
"1830824670","2021-01-22 05:00:07","What Kamala Harris Means For Girls","https://www.nytimes.com/2021/01/22/opinion/kamala-harris-girls.html","en","False","","1","New York Times","http://nytimes.com"
"1830824638","2021-01-22 05:00:18","A President Can Govern in Poetry","https://www.nytimes.com/2021/01/22/opinion/biden-poetry-amanda-gorman-seamus-heaney-inauguration.html","en","False","","1","New York Times","http://nytimes.com"
"1830824629","2021-01-22 05:00:19","What Jerry Brown Could Teach Joe Biden","https://www.nytimes.com/2021/01/22/us/politics/jerry-brown-joe-biden.html","en","False","","1","New York Times","http://nytimes.com"
"1830824624","2021-01-22 05:00:22","Restoring Environmental Rules Rolled Back by Trump Could Take Years","https://www.nytimes.com/2021/01/22/climate/biden-environment.html","en","False","","1","New York Times","http://nytimes.com"
"1830824605","2021-01-22 05:00:28","Corporate America Views Biden With Optimism and Skepticism","https://www.nytimes.com/2021/01/22/business/corporate-america-biden-administration.html","en","False","","1","New York Times","http://nytimes.com"
"1830902839","2021-01-22 06:32:17","A Vaccine Road Trip","https://www.nytimes.com/2021/01/22/briefing/biden-fauci-trump-covid-vaccine.html","en","False","","1","New York Times","http://nytimes.com"
"1830918955","2021-01-22 07:00:04","Biden’s Virus Plans Meet Reality","https://www.nytimes.com/2021/01/22/us/politics/biden-coronavirus-plans-fauci-trump.html","en","False","","1","New York Times","http://nytimes.com"
"1830918952","2021-01-22 07:19:30","When Will Taxes Go Up?","https://www.nytimes.com/2021/01/22/business/dealbook/biden-tax-cuts.html","en","False","","1","New York Times","http://nytimes.com"
"1831006092","2021-01-22 08:31:33","What Dry Winter Weather Can Tell Us","https://www.nytimes.com/2021/01/22/us/california-winter-weather.html","en","False","","1","New York Times","http://nytimes.com"
"1831006059","2021-01-22 08:52:46","Experts see ‘a sea change’ as regulators consider the risks of climate change.","https://www.nytimes.com/live/2021/01/22/business/us-economy-coronavirus/experts-see-a-sea-change-as-regulators-consider-the-risks-of-climate-change","en","False","","1","New York Times","http://nytimes.com"
"1831147958","2021-01-22 10:22:09","Rain and Snow Headed for Wildfire-Damaged Areas of California","https://www.nytimes.com/2021/01/22/us/california-rain.html","en","False","","1","New York Times","http://nytimes.com"
"1831147896","2021-01-22 11:18:19","Preserving Brutal Histories, One Garment at a Time","https://www.nytimes.com/2021/01/22/world/asia/conservator-textiles-atrocities.html","en","False","","1","New York Times","http://nytimes.com"
"1831215004","2021-01-22 12:41:13","The House will transmit its impeachment article on Monday, but Trump’s trial may wait a week.","https://www.nytimes.com/live/2021/01/22/us/joe-biden/the-house-will-transmit-its-impeachment-article-on-monday-but-trumps-trial-may-wait-a-week","en","False","","1","New York Times","http://nytimes.com"
"1831214957","2021-01-22 12:44:22","Justin Trudeau to Get Biden’s First Official Call to a Foreign Leader","https://www.nytimes.com/2021/01/22/world/canada/biden-canada.html","en","False","","1","New York Times","http://nytimes.com"
"1831214948","2021-01-22 12:56:29","Three Books Offer New Ways to Think About Environmental Disaster","https://www.nytimes.com/2021/01/22/books/review/scorched-earth-emmanuel-kreike-how-to-prepare-for-climate-change-david-pogue-how-to-blow-up-a-pipeline-andreas-malm.html","en","False","","1","New York Times","http://nytimes.com"
"1831334120","2021-01-22 15:36:01","Trudeau Says He’s Looking Forward to Working with Biden","https://www.nytimes.com/video/world/canada/100000007566105/trudeau-biden-keystone-pipeline.html","en","False","","1","New York Times","http://nytimes.com"
"1831447667","2021-01-22 18:46:04","Sharon Begley, a Top Science Journalist, Is Dead at 64","https://www.nytimes.com/2021/01/22/science/sharon-begley-dead.html","en","False","","1","New York Times","http://nytimes.com"
"1831456167","2021-01-22 19:23:41","Fresh Starts at the Top in Both Washington and Ottawa","https://www.nytimes.com/2021/01/22/world/canada/washington-canada-biden-payette.html","en","False","","1","New York Times","http://nytimes.com"
"1831524476","2021-01-22 21:33:56","Two Trump appointees are being investigated for posting reports denying climate change.","https://www.nytimes.com/2021/01/22/us/two-trump-appointees-are-being-investigated-for-posting-reports-denying-climate-change.html","en","False","","1","New York Times","http://nytimes.com"
"1831536018","2021-01-22 22:27:15","Hong Kong locks down a neighborhood for the first time since the pandemic began.","https://www.nytimes.com/live/2021/01/22/world/covid-19-coronavirus/hongkong-covid-lockdown","en","False","","1","New York Times","http://nytimes.com"
"1831945307","2021-01-23 11:00:07","Hola, President Biden. Latin America Has a Message for You.","https://www.nytimes.com/2021/01/23/opinion/hola-president-biden-latin-america-has-a-message-for-you.html","en","False","","1","New York Times","http://nytimes.com"
"1832090108","2021-01-23 15:04:28","In Biden’s Catholic Faith, an Ascendant Liberal Christianity","https://www.nytimes.com/2021/01/23/us/biden-catholic-christian.html","en","False","","1","New York Times","http://nytimes.com"
"1832607135","2021-01-24 10:00:06","Hall of Fame Voting, Once an Honor, Is Now Seen as a Hassle","https://www.nytimes.com/2021/01/24/sports/baseball/hall-of-fame-voting.html","en","False","","1","New York Times","http://nytimes.com"
"1833033586","2021-01-25 01:00:05","What’s on TV This Week: ‘Snowpiercer’ and ‘Resident Alien’","https://www.nytimes.com/2021/01/25/arts/television/whats-on-tv-this-week-snowpiercer-resident-alien.html","en","False","","1","New York Times","http://nytimes.com"
"1833179607","2021-01-25 05:00:12","Even for Bargain Hunters, Green Cars Make Sense","https://www.nytimes.com/2021/01/25/opinion/electric-cars-climate-change.html","en","False","","1","New York Times","http://nytimes.com"
"1833179592","2021-01-25 05:00:14","Amazon Union Drive Takes Hold in Unlikely Place","https://www.nytimes.com/2021/01/25/business/amazon-union-alabama.html","en","False","","1","New York Times","http://nytimes.com"
"1833286742","2021-01-25 06:27:36","Debating Stimulus Checks","https://www.nytimes.com/2021/01/25/briefing/trump-fauci-fbi-capitol-riot-impeachment.html","en","False","","1","New York Times","http://nytimes.com"
"1833319496","2021-01-25 07:26:36","The I.R.S. will start accepting tax returns on Feb. 12, about two weeks later than usual.","https://www.nytimes.com/live/2021/01/25/business/us-economy-coronavirus/the-irs-will-start-accepting-tax-returns-on-feb-12-about-two-weeks-later-than-usual","en","False","","1","New York Times","http://nytimes.com"
"1833397958","2021-01-25 09:07:51","What Is Happening With the Virus in California? For Now, Many Mixed Signals","https://www.nytimes.com/2021/01/25/us/california-covid.html","en","False","","1","New York Times","http://nytimes.com"
"1833467068","2021-01-25 10:01:06","Senate Filibuster Debate Roils Chamber","https://www.nytimes.com/2021/01/25/us/senate-filibuster.html","en","False","","1","New York Times","http://nytimes.com"
"1833614003","2021-01-25 13:00:06","Twitter will test letting some users fact-check tweets.","https://www.nytimes.com/live/2020/2020-election-misinformation-distortions/twitter-will-test-letting-some-users-fact-check-tweets","en","False","","1","New York Times","http://nytimes.com"
"1833661539","2021-01-25 13:47:37","A Nation in Pain: ‘The Daily’ Covers the Effects of Centuries of Systemic Racism in the U.S.","https://www.nytimes.com/2021/01/25/podcasts/daily-podcast-racial-injustice.html","en","False","","1","New York Times","http://nytimes.com"
"1833689965","2021-01-25 14:18:18","My Playbill Memories","https://www.nytimes.com/2021/01/25/opinion/letters/playbill-theater.html","en","False","","1","New York Times","http://nytimes.com"
"1833689897","2021-01-25 14:44:45","Climate Change Is Worsening. So the Weather Station Is Singing About It.","https://www.nytimes.com/2021/01/25/arts/music/weather-station-ignorance.html","en","False","","1","New York Times","http://nytimes.com"
"1833689881","2021-01-25 14:49:18","New U.S. Strategy Would Quickly Free Billions in Climate Funds","https://www.nytimes.com/2021/01/25/climate/fema-climate-spending.html","en","False","","1","New York Times","http://nytimes.com"
"1833734358","2021-01-25 15:16:37","Officials want to free up as much as $10 billion to protect U.S. against natural disasters.","https://www.nytimes.com/live/2021/01/25/us/biden-trump-impeachment/officials-want-to-free-up-as-much-as-10-billion-to-protect-us-against-natural-disasters","en","False","","1","New York Times","http://nytimes.com"
"1833827440","2021-01-25 18:15:30","Biden Launches Climate Change Efforts","https://www.nytimes.com/2021/01/25/climate/biden-climate-change.html","en","False","","1","New York Times","http://nytimes.com"
"1833849049","2021-01-25 18:23:03","Senate Confirms Janet L. Yellen as Treasury Secretary","https://www.nytimes.com/2021/01/25/us/politics/senate-yellen-treasury-secretary.html","en","False","","1","New York Times","http://nytimes.com"
"1833909451","2021-01-25 20:24:46","Dissidents First: A Foreign Policy Doctrine for the Biden Administration","https://www.nytimes.com/2021/01/25/opinion/navalny-biden-russia.html","en","False","","1","New York Times","http://nytimes.com"
"1834061110","2021-01-25 14:51:18","FEMA Plan Would Free Up Billions for Preventing Climate Disasters","https://www.nytimes.com/2021/01/25/climate/fema-climate-spending-biden.html","en","False","","1","New York Times","http://nytimes.com"
"1834268279","2021-01-26 05:00:05","Why Is Big Tech Policing Free Speech? Because the Government Isn’t","https://www.nytimes.com/2021/01/26/magazine/free-speech-tech.html","en","False","","1","New York Times","http://nytimes.com"
"1834268258","2021-01-26 05:42:33","My Trump Recovery Program","https://www.nytimes.com/2021/01/26/opinion/trump-TV-recovery.html","en","False","","1","New York Times","http://nytimes.com"
"1834268257","2021-01-26 05:00:15","Fashion Trends Are Often Recycled. Now More Clothing Can Be, Too.","https://www.nytimes.com/2021/01/26/fashion/sustainability-clothes-environment-technology.html","en","False","","1","New York Times","http://nytimes.com"
"1834268255","2021-01-26 05:00:15","How Nan Whaley, Dayton’s Mayor, Sees Ohio Politics and Portman’s Senate Seat","https://www.nytimes.com/2021/01/26/us/politics/nan-whaley-rob-portman-senate.html","en","False","","1","New York Times","http://nytimes.com"
"1834268253","2021-01-26 05:00:16","As Senate Weighs Biden’s Commerce Pick, Here’s What to Watch","https://www.nytimes.com/2021/01/26/business/economy/gina-raimondo-commerce.html","en","False","","1","New York Times","http://nytimes.com"
"1834284912","2021-01-26 06:14:40","BlackRock's Larry Fink Sets a Bolder Climate Goal in Annual Letter","https://www.nytimes.com/2021/01/26/business/dealbook/larry-fink-letter-blackrock-climate.html","en","False","","1","New York Times","http://nytimes.com"
"1834284907","2021-01-26 06:06:02","Larry Fink of BlackRock Sets Bold Climate Goals for Corporate America","https://www.nytimes.com/2021/01/26/business/dealbook/larry-fink-blackrock-climate.html","en","False","","1","New York Times","http://nytimes.com"
"1834427359","2021-01-26 08:32:46","An impasse ends in the Senate as Democrats win a filibuster battle.","https://www.nytimes.com/live/2021/01/26/us/biden-trump-impeachment/an-impasse-ends-in-the-senate-as-democrats-win-a-filibuster-battle","en","False","","1","New York Times","http://nytimes.com"
"1834517704","2021-01-26 10:19:33","Biden plans to announce new actions targeting racial inequality and police violence against Black people.","https://www.nytimes.com/live/2021/01/26/us/biden-trump-impeachment/biden-plans-to-announce-new-actions-targeting-racial-inequality-and-police-violence-against-black-people","en","False","","1","New York Times","http://nytimes.com"
"1834517671","2021-01-26 10:04:15","Gina M. Raimondo, Biden’s nominee for commerce secretary, testifies before the Senate.","https://www.nytimes.com/live/2021/01/26/business/us-economy-coronavirus/gina-m-raimondo-bidens-nominee-for-commerce-secretary-testifies-before-the-senate","en","False","","1","New York Times","http://nytimes.com"
"1834599757","2021-01-26 11:46:08","How America’s Food System Could Change Under Biden","https://www.nytimes.com/2021/01/26/dining/usda-food-policy-biden.html","en","False","","1","New York Times","http://nytimes.com"
"1834628566","2021-01-26 12:18:40","Janet Yellen Is Sworn In as Treasury Secretary","https://www.nytimes.com/live/2021/01/26/us/biden-trump-impeachment/janet-yellen-treasury","en","False","","1","New York Times","http://nytimes.com"
"1834653108","2021-01-26 12:43:12","Antony J. Blinken is confirmed as secretary of state.","https://www.nytimes.com/live/2021/01/26/us/biden-trump-impeachment/antony-j-blinken-is-confirmed-as-secretary-of-state","en","False","","1","New York Times","http://nytimes.com"
"1834736430","2021-01-26 14:53:18","Your Wednesday Briefing","https://www.nytimes.com/2021/01/26/briefing/hong-kong-virus-india-tractor-protest.html","en","False","","1","New York Times","http://nytimes.com"
"1834840712","2021-01-26 16:53:15","Capitol riot investigation will slow as officials work to build more complicated cases, Justice Dept. says.","https://www.nytimes.com/live/2021/01/26/us/biden-trump-impeachment/capitol-riot-investigation-will-slow-as-officials-work-to-build-more-complicated-cases-justice-dept-says","en","False","","1","New York Times","http://nytimes.com"
"1834892045","2021-01-26 17:57:45","Cabinet Picks: Comparing Biden and Trump’s First Teams","https://www.nytimes.com/2021/01/26/us/politics/biden-trump-cabinet-compare.html","en","False","","1","New York Times","http://nytimes.com"
"1834921048","2021-01-26 18:49:40","Biden, With Powerful Allies and Foes, Targets Climate Change","https://www.nytimes.com/2021/01/26/climate/biden-climate-change.html","en","False","","1","New York Times","http://nytimes.com"
"1834950316","2021-01-26 19:35:08","Filibuster Fight Subsides, for Now, as Democrats Assume Full Senate Control","https://www.nytimes.com/2021/01/26/us/filibuster-senate.html","en","False","","1","New York Times","http://nytimes.com"
"1834974687","2021-01-26 20:18:55","Who Are House Managers in Trump's Impeachment Trial","https://www.nytimes.com/2021/01/26/us/politics/house-impeachment-managers-.html","en","False","","1","New York Times","http://nytimes.com"
"1835366086","2021-01-27 05:00:18","How Biden’s Climate Ambitions Could Shift America’s Global Footprint","https://www.nytimes.com/2021/01/27/climate/climate-change-biden-kerry.html","en","False","","1","New York Times","http://nytimes.com"
"1835366082","2021-01-27 05:00:18","Recycling in America Is a Mess. A New Bill Could Clean It Up.","https://www.nytimes.com/2021/01/27/arts/design/recycling-packaging-new-york.html","en","False","","1","New York Times","http://nytimes.com"
"1835413399","2021-01-27 06:32:02","The Filibuster Fight","https://www.nytimes.com/2021/01/27/briefing/vaccines-trump-impeachment-trial-hong-kong.html","en","False","","1","New York Times","http://nytimes.com"
"1835629913","2021-01-27 10:00:50","A long conspiratorial road led rioters to the Capitol.","https://www.nytimes.com/live/2021/01/27/us/biden-trump-impeachment/a-long-conspiratorial-road-led-rioters-to-the-capitol","en","False","","1","New York Times","http://nytimes.com"
"1835629893","2021-01-27 09:49:16","What Can the DOE Actually Do on Climate?","https://www.nytimes.com/2021/01/27/climate/jennifer-granholm-senate-confirmation.html","en","False","","1","New York Times","http://nytimes.com"
"1835629889","2021-01-27 09:40:55","Boeing reports a record $11.9 billion annual loss.","https://www.nytimes.com/live/2021/01/27/business/us-economy-coronavirus/boeing-reports-a-record-11-9-billion-annual-loss","en","False","","1","New York Times","http://nytimes.com"
"1835629876","2021-01-27 09:01:29","In Sweeping Actions on Climate, Biden to ‘Pause’ Oil and Gas Leasing","https://www.nytimes.com/2021/01/27/climate/biden-climate-executive-orders.html","en","False","","1","New York Times","http://nytimes.com"
"1835629865","2021-01-27 09:36:55","The Battle Takes Shape","https://www.nytimes.com/2021/01/27/climate/biden-nyt-climate-newsletter.html","en","False","","1","New York Times","http://nytimes.com"
"1835629844","2021-01-27 10:31:29","Biden Team Rushes to Take Over Government, and Oust Trump Loyalists","https://www.nytimes.com/2021/01/27/us/politics/biden-government.html","en","False","","1","New York Times","http://nytimes.com"
"1835706622","2021-01-27 11:34:27","John Kerry urges business leaders to invest in green jobs.","https://www.nytimes.com/live/2021/01/27/business/us-economy-coronavirus/john-kerry-urges-business-leaders-to-invest-in-green-jobs","en","False","","1","New York Times","http://nytimes.com"
"1835782437","2021-01-27 13:36:10","Linda Thomas-Greenfield, Biden’s pick for U.N. ambassador, calls 2019 China speech ‘a huge mistake.’","https://www.nytimes.com/live/2021/01/27/us/biden-trump-impeachment/linda-thomas-greenfield-china","en","False","","1","New York Times","http://nytimes.com"
"1835809533","2021-01-27 14:01:56","Biden signs sweeping climate orders focusing on job creation and including a ‘pause’ in fossil fuel leasing.","https://www.nytimes.com/live/2021/01/27/us/biden-trump-impeachment/biden-signs-sweeping-climate-orders-focusing-on-job-creation-and-including-a-pause-in-fossil-fuel-leasing","en","False","","1","New York Times","http://nytimes.com"
"1835809529","2021-01-27 13:51:52","Automaker agrees to pay $30 million to settle federal corruption investigation.","https://www.nytimes.com/live/2021/01/27/business/us-economy-coronavirus/automaker-agrees-to-pay-30-million-to-settle-federal-corruption-investigation","en","False","","1","New York Times","http://nytimes.com"
"1835857163","2021-01-27 15:00:06","Joe Biden and Tom Vilsack's Big Plan to Save Rural America","https://www.nytimes.com/2021/01/27/opinion/biden-vilsack-agriculture-climate-change.html","en","False","","1","New York Times","http://nytimes.com"
"1835908973","2021-01-27 16:04:23","Denis McDonough, Biden’s nominee for V.A. secretary, tells Senators he’ll prioritize care access amid pandemic.","https://www.nytimes.com/live/2021/01/27/us/biden-trump-impeachment/denis-mcdonough-bidens-nominee-for-va-secretary-tells-senators-hell-prioritize-care-access-amid-pandemic","en","False","","1","New York Times","http://nytimes.com"
"1835976529","2021-01-27 17:32:14","Why Aren't Progressives Pressuring Biden on the Filibuster?","https://www.nytimes.com/2021/01/27/us/politics/biden-filibuster.html","en","False","","1","New York Times","http://nytimes.com"
"1835991329","2021-01-27 18:02:30","Climate Change, Capitol Hill, Cloris Leachman: Your Wednesday Evening Briefing","https://www.nytimes.com/2021/01/27/briefing/climate-change-capitol-hill-cloris-leachman.html","en","False","","1","New York Times","http://nytimes.com"
"1836010896","2021-01-27 18:21:48","One Year Later, Doomsday Clock Says World Is Still ‘100 Seconds’ From Disaster","https://www.nytimes.com/2021/01/27/us/doomsday-clock-midnight.html","en","False","","1","New York Times","http://nytimes.com"
"1836028264","2021-01-27 18:41:02","After the presidency, the Trump hotel in Washington is a limited draw.","https://www.nytimes.com/live/2021/01/27/us/biden-trump-impeachment/trump-hotel-washington","en","False","","1","New York Times","http://nytimes.com"
"1836046081","2021-01-27 19:30:57","Ease Up on the Executive Actions, Joe","https://www.nytimes.com/2021/01/27/opinion/biden-executive-orders.html","en","False","","1","New York Times","http://nytimes.com"
"1836061679","2021-01-27 19:36:52","Who Will Pay to Get America Back on Its Feet?","https://www.nytimes.com/2021/01/27/opinion/wealth-tax-tech.html","en","False","","1","New York Times","http://nytimes.com"
"1836327711","2021-01-27 19:22:50","Here’s what Biden’s pick for energy secretary could do to fight climate change.","https://www.nytimes.com/2021/01/27/us/heres-what-bidens-pick-for-energy-secretary-could-do-to-fight-climate-change.html","en","False","","1","New York Times","http://nytimes.com"
"1836397935","2021-01-28 05:00:17","So You Want to Open a Hotel? Now?","https://www.nytimes.com/2021/01/28/travel/virus-new-hotels-opening.html","en","False","","1","New York Times","http://nytimes.com"
"1836471148","2021-01-28 06:27:41","A Fall in Virus Cases","https://www.nytimes.com/2021/01/28/briefing/gamestop-stock-tesla-biden-climate.html","en","False","","1","New York Times","http://nytimes.com"
"1836484444","2021-01-28 07:01:24","Biden Walks the Climate-Economy Tightrope","https://www.nytimes.com/2021/01/28/us/politics/biden-climate-economy-jobs.html","en","False","","1","New York Times","http://nytimes.com"
"1836483346","2021-01-28 07:00:09","‘The Reunited States’ Review: Hopeful Moments in a Political War","https://www.nytimes.com/2021/01/28/movies/the-reunited-states-review.html","en","False","","1","New York Times","http://nytimes.com"
"1836584778","2021-01-28 07:44:54","How GameStop's Reddit-Fueled Rise May End","https://www.nytimes.com/2021/01/28/business/dealbook/reddit-gamestop-trading.html","en","False","","1","New York Times","http://nytimes.com"
"1836584753","2021-01-28 08:30:43","Biden plans to reopen Obamacare exchanges in many states.","https://www.nytimes.com/live/2021/01/28/us/biden-trump-impeachment/biden-plans-to-reopen-obamacare-exchanges-in-many-states","en","False","","1","New York Times","http://nytimes.com"
"1836605189","2021-01-28 08:47:59","The Debate Over San Francisco’s School Names","https://www.nytimes.com/2021/01/28/us/san-francisco-school-names.html","en","False","","1","New York Times","http://nytimes.com"
"1836776228","2021-01-28 12:03:06","GameStop plunges after platforms place more restrictions on trading.","https://www.nytimes.com/live/2021/01/28/business/us-economy-coronavirus/gamestop-plunges-after-platforms-place-more-restrictions-on-trading","en","False","","1","New York Times","http://nytimes.com"
"1836883612","2021-01-28 13:58:42","Swift Action by Biden to Reverse Trump Policies","https://www.nytimes.com/2021/01/28/opinion/letters/biden-executive-orders.html","en","False","","1","New York Times","http://nytimes.com"
"1837040954","2021-01-28 18:00:03","Can Biden Deliver on His Climate Promises?","https://www.nytimes.com/2021/01/28/opinion/biden-climate-change.html","en","False","","1","New York Times","http://nytimes.com"
"1837065666","2021-01-28 19:00:06","The G.O.P. Is in a Doom Loop of Bizarro","https://www.nytimes.com/2021/01/28/opinion/republican-lies.html","en","False","","1","New York Times","http://nytimes.com"
"1837566970","2021-01-29 08:13:03","Robinhood Faces a Cash Drain and Angry Customers","https://www.nytimes.com/2021/01/29/business/dealbook/robinhood-fundraise-customers.html","en","False","","1","New York Times","http://nytimes.com"
"1837593840","2021-01-29 08:43:27","The Debate Over Reopening Schools","https://www.nytimes.com/2021/01/29/us/california-schools-reopening.html","en","False","","1","New York Times","http://nytimes.com"
"1837825529","2021-01-29 12:50:27","Former U.S. Climate Leaders Press Biden on Amazon Deforestation","https://www.nytimes.com/2021/01/29/climate/biden-amazon-deforestation.html","en","False","","1","New York Times","http://nytimes.com"
"1837825524","2021-01-29 13:17:37","Electric Cars Are Coming, and Fast. Is the Nation’s Grid Up to It?","https://www.nytimes.com/2021/01/29/climate/gm-electric-cars-power-grid.html","en","False","","1","New York Times","http://nytimes.com"
"1837892167","2021-01-29 14:44:46","Gleeful Over Biden’s Actions on Climate Change","https://www.nytimes.com/2021/01/29/opinion/letters/biden-climate.html","en","False","","1","New York Times","http://nytimes.com"
"1838060139","2021-01-29 19:46:22","Biden intelligence briefings to be led by veteran C.I.A. officer, who previously briefed George W. Bush.","https://www.nytimes.com/live/2021/01/29/us/biden-trump-impeachment/biden-intelligence-briefings-to-be-led-by-veteran-cia-officer-who-previously-briefed-george-w-bush","en","False","","1","New York Times","http://nytimes.com"
"1838373520","2021-01-30 05:00:07","Forecast: Wild Weather in a Warming World","https://www.nytimes.com/2021/01/30/climate/polar-vortex-weather-climate-change.html","en","False","","1","New York Times","http://nytimes.com"
"1838584775","2021-01-30 12:43:39","At Elite French Universities, Students Demand Environmental Action","https://www.nytimes.com/2021/01/30/world/europe/france-elite-universities-environment.html","en","False","","1","New York Times","http://nytimes.com"
"1838650859","2021-01-30 14:45:15","Biden’s Nightmare May Be China","https://www.nytimes.com/2021/01/30/opinion/sunday/foreign-policy-china.html","en","False","","1","New York Times","http://nytimes.com"
"1839128002","2021-01-31 07:00:04","The Week in Business: GameStop’s Bizarre Saga","https://www.nytimes.com/2021/01/31/business/the-week-in-business-gamestop.html","en","False","","1","New York Times","http://nytimes.com"
"1839216292","2021-01-31 18:43:59","Black Power: Now or Never","https://www.nytimes.com/2021/01/31/opinion/black-power-us-voting.html","en","False","","1","New York Times","http://nytimes.com"
"1839212854","2021-02-01 05:00:08","How Biden Should Fix U.S.-Canada Relations","https://www.nytimes.com/2021/02/01/opinion/biden-trudeau-canada.html","en","False","","1","New York Times","http://nytimes.com"
