stories_id,publish_date,title,url,language,ap_syndicated,themes,media_id,media_name,media_url
"1848251341","2021-02-10 11:44:37","Bernie Sanders grills President Biden’s nominee to head the budget office.","https://www.nytimes.com/live/2021/02/10/business/stock-market-today/bernie-sanders-grills-president-bidens-nominee-to-head-the-budget-office","en","False","","1","New York Times","http://nytimes.com"
"1848298376","2021-02-10 12:33:59","True Crime With a Climate Connection","https://www.nytimes.com/2021/02/10/climate/nyt-climate-newsletter-catalytic-converters.html","en","False","","1","New York Times","http://nytimes.com"
"1848399042","2021-02-10 14:30:04","Annotated by the Author: ‘How Animal Crossing Will Save Gen Z’","https://www.nytimes.com/2021/02/10/learning/annotated-by-the-author-how-animal-crossing-will-save-gen-z.html","en","False","","1","New York Times","http://nytimes.com"
"1848423110","2021-02-10 15:07:09","Your Thursday Briefing","https://www.nytimes.com/2021/02/10/briefing/impeachment-trial-twitter-india-virus.html","en","False","","1","New York Times","http://nytimes.com"
"1848577229","2021-02-10 19:01:13","Biden Charts a New Course in Guatemala","https://www.nytimes.com/2021/02/10/opinion/guatemala-biden.html","en","False","","1","New York Times","http://nytimes.com"
"1848639653","2021-02-10 16:31:58","G.M.’s Profits From Trucks and S.U.V.s Fuel Its Electric Quest","https://www.nytimes.com/2021/02/10/business/gm-profits-electric-cars.html","en","False","","1","New York Times","http://nytimes.com"
"1848647058","2021-02-10 21:40:07","Biden Speaks With China’s Xi for First Time as President","https://www.nytimes.com/2021/02/10/us/politics/biden-xi-jinping-call.html","en","False","","1","New York Times","http://nytimes.com"
"1848928964","2021-02-11 05:00:06","How the Trump Era Broke the Sunday-Morning News Show","https://www.nytimes.com/2021/02/11/magazine/how-the-trump-era-broke-the-sunday-morning-news-show.html","en","False","","1","New York Times","http://nytimes.com"
"1848928896","2021-02-11 05:00:18","California Is Making Liberals Squirm","https://www.nytimes.com/2021/02/11/opinion/california-san-francisco-schools.html","en","False","","1","New York Times","http://nytimes.com"
"1849051469","2021-02-11 07:19:46","Jane Fraser Faces a Big Repair Job at Citi","https://www.nytimes.com/2021/02/11/business/dealbook/jane-fraser-citigroup.html","en","False","","1","New York Times","http://nytimes.com"
"1849410169","2021-02-11 14:00:07","Biden’s Climate Task Force Opens for Business, Aiming to Restore ‘Credibility’","https://www.nytimes.com/2021/02/11/climate/biden-climate-change.html","en","False","","1","New York Times","http://nytimes.com"
"1849410167","2021-02-11 14:00:08","Whale Songs Could Reveal Deep Secrets Beneath the Oceans","https://www.nytimes.com/2021/02/11/science/whales-seismic-waves.html","en","False","","1","New York Times","http://nytimes.com"
"1849434874","2021-02-11 14:51:26","Warming and Warnings From the High Himalayas","https://www.nytimes.com/2021/02/11/opinion/climate-change-himalayas.html","en","False","","1","New York Times","http://nytimes.com"
"1849483066","2021-02-11 15:45:05","Republican Attacks on A.O.C.","https://www.nytimes.com/2021/02/11/opinion/letters/aoc-republicans.html","en","False","","1","New York Times","http://nytimes.com"
"1849498767","2021-02-11 16:00:57","What Are You Arguing About?","https://www.nytimes.com/2021/02/11/opinion/what-are-you-arguing-about.html","en","False","","1","New York Times","http://nytimes.com"
"1849537313","2021-02-11 17:19:38","Jamie Raskin and A.O.C. Reveal That Politicians Are Real People","https://www.nytimes.com/2021/02/11/opinion/raskin-aoc-politicians-emotion.html","en","False","","1","New York Times","http://nytimes.com"
"1849614285","2021-02-11 19:14:04","Impeachment, Oil, Bruce Springsteen: Your Thursday Evening Briefing","https://www.nytimes.com/2021/02/11/briefing/impeachment-oil-bruce-springsteen.html","en","False","","1","New York Times","http://nytimes.com"
"1849715327","2021-02-11 22:33:58","Twitter suspends Project Veritas, a conservative group, over tweets.","https://www.nytimes.com/live/2020/11/12/us/joe-biden-trump/twitter-suspends-project-veritas-a-conservative-group-over-tweets","en","False","","1","New York Times","http://nytimes.com"
"1849943708","2021-02-12 04:28:16","Superstudio: The Architects Who Dreamt of a Future With No Buildings","https://www.nytimes.com/2021/02/12/arts/design/superstudio-civa.html","en","False","","1","New York Times","http://nytimes.com"
"1849943698","2021-02-12 05:00:04","Transcript: Ezra Klein Interviews Adam Jentleson about the Senate","https://www.nytimes.com/2021/02/12/podcasts/ezra-klein-podcast-adam-jentleson-transcript.html","en","False","","1","New York Times","http://nytimes.com"
"1849987474","2021-02-12 05:38:15","Refugees Flee Central African Republic, a Crisis the World Neglects","https://www.nytimes.com/2021/02/12/world/africa/central-african-republic.html","en","False","","1","New York Times","http://nytimes.com"
"1850392853","2021-02-12 12:52:05","Electric Cars, Cool. But When?","https://www.nytimes.com/2021/02/12/technology/electric-cars-batteries.html","en","False","","1","New York Times","http://nytimes.com"
"1850448803","2021-02-12 14:22:13","Janet Yellen says the U.S. will rebuild alliances and refocus on climate change.","https://www.nytimes.com/live/2021/02/12/business/stock-market-today/janet-yellen-says-the-us-will-rebuild-alliances-and-refocus-on-climate-change","en","False","","1","New York Times","http://nytimes.com"
"1850496589","2021-02-12 15:08:37","Bubba Wallace Needed NASCAR Help. Michael Jordan Took it Personal.","https://www.nytimes.com/2021/02/12/sports/autoracing/michael-jordan-bubba-hamlin-nascar.html","en","False","","1","New York Times","http://nytimes.com"
"1851045991","2021-02-13 05:00:07","A Guide to Impeachment Trial: Start Time, Streaming and More","https://www.nytimes.com/2021/02/13/us/politics/what-time-trump-impeachment-trial.html","en","False","","1","New York Times","http://nytimes.com"
"1852256106","2021-02-14 19:26:24","Biden Takes Center Stage With Ambitious Agenda as Trump’s Trial Ends","https://www.nytimes.com/2021/02/14/us/politics/biden-agenda-impeachment-trump.html","en","False","","1","New York Times","http://nytimes.com"
"1852615235","2021-02-15 05:00:04","Book Review: ‘How to Avoid a Climate Change Disaster,’ by Bill Gates","https://www.nytimes.com/2021/02/15/books/review/bill-gates-how-to-avoid-a-climate-disaster.html","en","False","","1","New York Times","http://nytimes.com"
"1852615225","2021-02-15 05:00:09","How Pandemic Lunches Gave Me Hope for the Planet","https://www.nytimes.com/2021/02/15/climate/pandemic-lunches-leftovers.html","en","False","","1","New York Times","http://nytimes.com"
"1852615221","2021-02-15 05:00:11","Innovation, Not Trees. How Bill Gates Plans to Save the Planet.","https://www.nytimes.com/2021/02/15/opinion/sway-kara-swisher-bill-gates.html","en","False","","1","New York Times","http://nytimes.com"
"1852615205","2021-02-15 05:00:12","Ancient Rome Has an Urgent Warning for Us","https://www.nytimes.com/2021/02/15/opinion/ancient-rome-covid.html","en","False","","1","New York Times","http://nytimes.com"
"1852615191","2021-02-15 05:00:13","Speed of Courts at Issue in Australian Open","https://www.nytimes.com/2021/02/15/sports/tennis/australian-open-fast-courts.html","en","False","","1","New York Times","http://nytimes.com"
"1852615169","2021-02-15 05:00:18","Along the Southwest Border, Trump’s Wall Is Only One of the Insults He Left Behind","https://www.nytimes.com/2021/02/15/opinion/border-wall-trump.html","en","False","","1","New York Times","http://nytimes.com"
"1852659388","2021-02-15 06:12:35","The G.O.P. and Public Opinion","https://www.nytimes.com/2021/02/15/briefing/winter-storm-president-biden-meghan-markle-pregnant.html","en","False","","1","New York Times","http://nytimes.com"
"1852851675","2021-02-15 09:58:48","At least 150 million Americans are in the storm’s path.","https://www.nytimes.com/live/2021/02/15/us/winter-storm-weather-live/at-least-150-million-americans-are-in-the-storms-path","en","False","","1","New York Times","http://nytimes.com"
"1852851624","2021-02-15 10:03:33","‘Right Now Feels So Long and Without Any End in Sight’","https://www.nytimes.com/2021/02/15/science/science-covid-mental-health.html","en","False","","1","New York Times","http://nytimes.com"
"1852930313","2021-02-15 11:34:59","Climate Activist Jailed in India as Government Clamps Down on Dissent","https://www.nytimes.com/2021/02/15/world/asia/climate-activist-jailed-india.html","en","False","","1","New York Times","http://nytimes.com"
"1852959934","2021-02-15 12:01:30","Climate change may be why frigid weather has slid so far south, experts say.","https://www.nytimes.com/live/2021/02/15/us/winter-storm-weather-live/climate-change-may-be-why-frigid-weather-has-slid-so-far-south-experts-say","en","False","","1","New York Times","http://nytimes.com"
"1853097099","2021-02-15 15:06:42","Your Tuesday Briefing","https://www.nytimes.com/2021/02/15/briefing/virus-quarantines-myanmar-protests-snowstorms.html","en","False","","1","New York Times","http://nytimes.com"
"1853568868","2021-02-16 04:00:02","Gas or Electric? Thinking Algebraically About Car Costs, Emissions and Trade-offs","https://www.nytimes.com/2021/02/16/learning/gas-or-electric-thinking-algebraically-about-car-costs-emissions-and-trade-offs.html","en","False","","1","New York Times","http://nytimes.com"
"1853586775","2021-02-16 05:00:04","Transcript: Ezra Klein Interviews Heather McGhee about the Cost of Racism","https://www.nytimes.com/2021/02/16/podcasts/ezra-klein-podcast-mcghee-transcript.html","en","False","","1","New York Times","http://nytimes.com"
"1853676452","2021-02-16 05:42:22","Here’s what to expect on Tuesday, as millions are without power.","https://www.nytimes.com/live/2021/02/16/us/winter-storm-weather-live/heres-what-to-expect-on-tuesday-as-millions-are-without-power","en","False","","1","New York Times","http://nytimes.com"
"1853676428","2021-02-16 06:24:45","Two Men, Two Decades, No Evidence","https://www.nytimes.com/2021/02/16/briefing/winter-storm-adam-kinzinger-pelosi-congress.html","en","False","","1","New York Times","http://nytimes.com"
"1853733170","2021-02-16 07:21:34","The Company Policy That's Delaying Corporate Diversity","https://www.nytimes.com/2021/02/16/business/dealbook/diversity-corporate-boardrooms.html","en","False","","1","New York Times","http://nytimes.com"
"1853733168","2021-02-16 07:23:57","Storm slows coronavirus vaccine rollout as clinics close and deliveries","https://www.nytimes.com/live/2021/02/16/us/winter-storm-weather-live/storm-slows-coronavirus-vaccine-rollout-as-clinics-close-and-deliveries","en","False","","1","New York Times","http://nytimes.com"
"1853733167","2021-02-16 07:29:47","Accusations of Sexual Harassment Rock Greek Arts World","https://www.nytimes.com/2021/02/16/world/europe/greece-sexual-abuse-metoo.html","en","False","","1","New York Times","http://nytimes.com"
"1853917089","2021-02-16 10:33:32","With Trump’s impeachment trial over, ‘2021 can finally start’ for Biden.","https://www.nytimes.com/live/2021/02/16/us/joe-biden-trump/with-trumps-impeachment-trial-over-2021-can-finally-start-for-biden","en","False","","1","New York Times","http://nytimes.com"
"1854003698","2021-02-16 11:44:36","A Glimpse of the Future in Texas: Climate Change Means Trouble for Power Grids","https://www.nytimes.com/2021/02/16/climate/texas-power-grid-failures.html","en","False","","1","New York Times","http://nytimes.com"
"1854082384","2021-02-16 13:27:22","Hillary Clinton Thinks a White House Gender Council Is a Crucial ‘First Step’","https://www.nytimes.com/2021/02/16/us/hillary-clinton-women-gender-council-white-house.html","en","False","","1","New York Times","http://nytimes.com"
"1854272022","2021-02-16 18:09:40","Coronavirus Briefing: What Happened Today","https://www.nytimes.com/2021/02/16/us/coronavirus-today.html","en","False","","1","New York Times","http://nytimes.com"
"1854302145","2021-02-16 19:00:05","What Trump, San Francisco and the Deer in My Backyard Have in Common","https://www.nytimes.com/2021/02/16/opinion/republican-party-democracy.html","en","False","","1","New York Times","http://nytimes.com"
"1854377817","2021-02-16 21:28:46","There were unequal effects of the blackouts in Texas.","https://www.nytimes.com/live/2021/02/16/us/winter-storm-weather-live/there-were-unequal-effects-of-the-blackouts-in-texas","en","False","","1","New York Times","http://nytimes.com"
"1854468172","2021-02-17 00:13:57","Shortages in Texas are a glimpse into America’s power future.","https://www.nytimes.com/live/2021/02/16/us/winter-storm-weather-live/shortages-in-texas-are-a-glimpse-into-americas-power-future","en","False","","1","New York Times","http://nytimes.com"
"1854480853","2021-02-17 00:40:55","Los Angeles School District Eliminates One-Third of Its Police Officers","https://www.nytimes.com/2021/02/17/us/los-angeles-school-police.html","en","False","","1","New York Times","http://nytimes.com"
"1854711652","2021-02-17 05:00:23","A Different Kind of Land Management: Let the Cows Stomp","https://www.nytimes.com/2021/02/17/climate/regenerative-grazing-cattle-climate.html","en","False","","1","New York Times","http://nytimes.com"
"1854757096","2021-02-17 06:10:50","Millions of Texans wait for power to return, with more snow on the way.","https://www.nytimes.com/live/2021/02/17/us/winter-storm-weather-live/millions-of-texans-wait-for-power-to-return-with-more-snow-on-the-way","en","False","","1","New York Times","http://nytimes.com"
"1854756973","2021-02-17 05:00:23","When the Bill Comes Due in Europe, ‘How Are We Going to Pay for All This?’","https://www.nytimes.com/2021/02/17/business/europe-pandemic-debt.html","en","False","","1","New York Times","http://nytimes.com"
"1854756935","2021-02-17 06:00:07","The Daily: Climate Change and the Texas Blackouts","https://www.nytimes.com/2021/02/17/podcasts/the-daily/texas-statewide-blackout-climate-change.html","en","False","","1","New York Times","http://nytimes.com"
"1854756931","2021-02-17 06:00:08","The Smart Way to Grow Roses","https://www.nytimes.com/2021/02/17/realestate/the-smart-way-to-grow-roses.html","en","False","","1","New York Times","http://nytimes.com"
"1854889743","2021-02-17 08:48:08","California’s Shifting Relationship With the Supreme Court","https://www.nytimes.com/2021/02/17/us/california-supreme-court.html","en","False","","1","New York Times","http://nytimes.com"
"1855014822","2021-02-17 11:15:17","Biden will meet with labor leaders to discuss the virus relief bill and seek input on an infrastructure plan.","https://www.nytimes.com/live/2021/02/17/us/joe-biden-trump/biden-will-meet-with-labor-leaders-to-discuss-the-virus-relief-bill-and-seek-input-on-an-infrastructure-plan","en","False","","1","New York Times","http://nytimes.com"
"1855123716","2021-02-17 13:16:35","The Far-Reaching Effects of the Storm, on Power and People","https://www.nytimes.com/2021/02/17/climate/storms-power-outage-newsletter.html","en","False","","1","New York Times","http://nytimes.com"
"1855185410","2021-02-17 14:22:32","Biden on ‘Short Leash’ as Administration Rethinks China Relations","https://www.nytimes.com/2021/02/17/business/economy/biden-china.html","en","False","","1","New York Times","http://nytimes.com"
"1855254499","2021-02-17 15:48:12","The U.S. charges 3 North Koreans with hacking and stealing millions of dollars.","https://www.nytimes.com/live/2021/02/17/us/joe-biden-trump/the-us-charges-3-north-koreans-with-hacking-and-stealing-millions-of-dollars","en","False","","1","New York Times","http://nytimes.com"
"1855340801","2021-02-17 18:05:04","Texas, Rush Limbaugh, Mammoths: Your Wednesday Evening Briefing","https://www.nytimes.com/2021/02/17/briefing/texas-rush-limbaugh-mammoths.html","en","False","","1","New York Times","http://nytimes.com"
"1855369330","2021-02-17 18:24:31","Frigid weather puts millions under boil water notices throughout Texas.","https://www.nytimes.com/live/2021/02/17/us/winter-storm-weather-live/frigid-weather-puts-millions-under-boil-water-notices-throughout-texas","en","False","","1","New York Times","http://nytimes.com"
"1865131202","2021-02-27 10:00:06","Los privilegios de pertenecer a la asociación que entrega los Globos de Oro","https://www.nytimes.com/es/2021/02/27/espanol/globos-oro.html","es","False","","1","New York Times","http://nytimes.com"
"1855445909","2021-02-17 20:43:13","Cuomo Faces Revolt as Legislators Move to Strip Him of Pandemic Powers","https://www.nytimes.com/2021/02/17/nyregion/cuomo-nursing-homes-deaths.html","en","False","","1","New York Times","http://nytimes.com"
"1855607281","2021-02-18 01:24:10","Late Night Blasts Conservatives Blaming Windmills for Texas Blackouts","https://www.nytimes.com/2021/02/18/arts/television/late-night-texas-blackout.html","en","False","","1","New York Times","http://nytimes.com"
"1855778799","2021-02-18 05:00:12","How to Prevent the Next Texas Power Breakdown","https://www.nytimes.com/2021/02/18/opinion/future-proof-texas-grid.html","en","False","","1","New York Times","http://nytimes.com"
"1855778781","2021-02-18 05:00:15","How Bang on a Can Survived the ’90s","https://www.nytimes.com/2021/02/18/arts/music/bang-on-a-can-music.html","en","False","","1","New York Times","http://nytimes.com"
"1855778742","2021-02-18 05:00:30","Several inches of snow are expected in the New York area.","https://www.nytimes.com/live/2021/02/18/us/winter-storm-weather-live/several-inches-of-snow-are-expected-in-the-new-york-area","en","False","","1","New York Times","http://nytimes.com"
"1855864767","2021-02-18 06:21:32","Frigid Weather and Global Warming","https://www.nytimes.com/2021/02/18/briefing/texas-blackouts-mars-rover-cuomo-new-york.html","en","False","","1","New York Times","http://nytimes.com"
"1855864759","2021-02-18 06:27:11","A Times climate reporter answers questions about this week’s weather.","https://www.nytimes.com/live/2021/02/18/us/winter-storm-weather-live/a-times-climate-reporter-answers-questions-about-this-weeks-weather","en","False","","1","New York Times","http://nytimes.com"
"1855922978","2021-02-18 07:21:35","How to use snow when there’s no water flowing from the faucet.","https://www.nytimes.com/live/2021/02/18/us/winter-storm-weather-live/how-to-use-snow-when-theres-no-water-flowing-from-the-faucet","en","False","","1","New York Times","http://nytimes.com"
"1855922968","2021-02-18 07:36:51","Lesson of the Day: ‘Icy Storm Barrels Across Central U.S., Leaving Millions Without Power’","https://www.nytimes.com/2021/02/18/learning/lesson-of-the-day-icy-storm-barrels-across-central-us-leaving-millions-without-power.html","en","False","","1","New York Times","http://nytimes.com"
"1855970454","2021-02-18 07:52:49","Natural gas futures rose 13 percent in a week as Texas froze.","https://www.nytimes.com/live/2021/02/18/business/stock-market-today/natural-gas-futures-rose-13-percent-in-a-week-as-texas-froze","en","False","","1","New York Times","http://nytimes.com"
"1855981374","2021-02-18 08:34:10","Unemployment claims show continuing pressure on the economy.","https://www.nytimes.com/live/2021/02/18/business/stock-market-today/unemployment-claims-show-continuing-pressure-on-the-economy","en","False","","1","New York Times","http://nytimes.com"
"1856019852","2021-02-18 08:54:11","Los Angeles’s Move to Reduce Police in Schools","https://www.nytimes.com/2021/02/18/us/los-angeles-police-schools.html","en","False","","1","New York Times","http://nytimes.com"
"1856042593","2021-02-18 09:30:03","What’s Stopping First-Time Home Buyers?","https://www.nytimes.com/2021/02/18/realestate/whats-stopping-first-time-home-buyers.html","en","False","","1","New York Times","http://nytimes.com"
"1856269715","2021-02-18 13:21:11","As Winter Sweeps the South, Fed Officials Focus on Climate Change","https://www.nytimes.com/2021/02/18/business/economy/federal-reserve-climate-change-banks.html","en","False","","1","New York Times","http://nytimes.com"
"1856269696","2021-02-18 13:28:35","Texas Storms, California Heat Waves and ‘Vulnerable’ Utilities","https://www.nytimes.com/2021/02/18/business/energy-environment/california-texas-blackouts-utilities.html","en","False","","1","New York Times","http://nytimes.com"
"1856305298","2021-02-18 14:00:13","A Hitchhiker’s Guide to an Ancient Geomagnetic Disruption","https://www.nytimes.com/2021/02/18/science/laschamp-earth-magnetic-climate.html","en","False","","1","New York Times","http://nytimes.com"
"1856327236","2021-02-18 14:34:17","The Storm That Knocked Out Texas","https://www.nytimes.com/2021/02/18/opinion/letters/texas-storm-power.html","en","False","","1","New York Times","http://nytimes.com"
"1856350461","2021-02-18 15:00:07","There’s One Big Problem With Electric Cars","https://www.nytimes.com/2021/02/18/opinion/electric-cars-SUV.html","en","False","","1","New York Times","http://nytimes.com"
"1856395661","2021-02-18 16:03:08","Texas, Land of Wind and Lies","https://www.nytimes.com/2021/02/18/opinion/texas-storm-power.html","en","False","","1","New York Times","http://nytimes.com"
"1856395654","2021-02-18 16:07:19","Lynn Stalmaster, Hollywood’s ‘Master Caster,’ Dies at 93","https://www.nytimes.com/2021/02/18/movies/lynn-stalmaster-casting-dead.html","en","False","","1","New York Times","http://nytimes.com"
"1856424943","2021-02-18 16:36:45","As FEMA sends aid, the White House warns that America is not ready for climate change.","https://www.nytimes.com/live/2021/02/18/us/winter-storm-weather-live/as-fema-sends-aid-the-white-house-warns-that-america-is-not-ready-for-climate-change","en","False","","1","New York Times","http://nytimes.com"
"1856560067","2021-02-18 20:07:21","Hospitals in Texas are losing resources and gaining patients.","https://www.nytimes.com/live/2021/02/18/us/winter-storm-weather-live/hospitals-in-texas-are-losing-resources-and-gaining-patients","en","False","","1","New York Times","http://nytimes.com"
"1856641128","2021-02-18 22:24:42","How to Help Winter Storm Relief in Texas, Oklahoma and Louisiana","https://www.nytimes.com/2021/02/18/us/how-to-help-storm-relief-texas-oklahoma-louisiana.html","en","False","","1","New York Times","http://nytimes.com"
"1856950558","2021-02-19 05:00:16","Biden’s Is Going Big, and Americans Are With Him","https://www.nytimes.com/2021/02/19/opinion/biden-democratic-majority-winning.html","en","False","","1","New York Times","http://nytimes.com"
"1856950543","2021-02-19 05:00:17","The Presidential Primary Calendar Stinks. Now’s the Time to Shake It Up.","https://www.nytimes.com/2021/02/19/opinion/nevada-caucus-primary-democrats.html","en","False","","1","New York Times","http://nytimes.com"
"1857101864","2021-02-19 07:25:31","Gunfire at Mogadishu Protest Intensifies Somali Election Impasse","https://www.nytimes.com/2021/02/19/world/africa/violence-mogadishu-somali-elections.html","en","False","","1","New York Times","http://nytimes.com"
"1857131106","2021-02-19 08:32:19","One month into his term, the Biden White House moves to maintain momentum.","https://www.nytimes.com/live/2021/02/19/us/joe-biden-news/one-month-into-his-term-the-biden-white-house-moves-to-maintain-momentum","en","False","","1","New York Times","http://nytimes.com"
"1857131094","2021-02-19 08:33:14","Global leaders gather to chart new course in post-Trump era.","https://www.nytimes.com/live/2021/02/19/world/g7-meeting-munich-security-conference/global-leaders-gather-to-chart-new-course-in-post-trump-era","en","False","","1","New York Times","http://nytimes.com"
"1857131051","2021-02-19 08:39:16","When There’s No Heat: ‘You Need Wood, You Get Wood.’","https://www.nytimes.com/2021/02/19/climate/wood-banks-winter-maine.html","en","False","","1","New York Times","http://nytimes.com"
"1857163649","2021-02-19 08:56:53","A Pandemic Silver Lining for a San Francisco Institution","https://www.nytimes.com/2021/02/19/us/san-francisco-de-young.html","en","False","","1","New York Times","http://nytimes.com"
"1857224163","2021-02-19 09:50:02","Transcript: Ezra Klein Interviews George Saunders","https://www.nytimes.com/2021/02/19/podcasts/ezra-klein-show-george-saunders-transcript.html","en","False","","1","New York Times","http://nytimes.com"
"1857235902","2021-02-19 10:19:31","U.S. formally rejoins the Paris climate accord.","https://www.nytimes.com/2021/02/19/world/us-rejoins-paris-climate-accord.html","en","False","","1","New York Times","http://nytimes.com"
"1857253730","2021-02-19 10:44:46","Global leaders chart a new course in post-Trump era.","https://www.nytimes.com/live/2021/02/19/world/g7-meeting-munich-security-conference/global-leaders-chart-a-new-course-in-post-trump-era","en","False","","1","New York Times","http://nytimes.com"
"1857311156","2021-02-19 11:28:52","W.H.O. head warns that unequal vaccine distribution poses global risk.","https://www.nytimes.com/live/2021/02/19/world/g7-meeting-munich-security-conference/who-head-warns-that-unequal-vaccine-distribution-poses-global-risk","en","False","","1","New York Times","http://nytimes.com"
"1857354873","2021-02-19 12:19:46","Ted Cruz Fled One Storm, but Flew Into Another","https://www.nytimes.com/2021/02/19/opinion/letters/ted-cruz-texas-storm.html","en","False","","1","New York Times","http://nytimes.com"
"1857564436","2021-02-19 16:57:16","Judge temporarily blocks South Carolina from imposing restrictive ‘heartbeat ban’ abortion law.","https://www.nytimes.com/live/2021/02/19/us/joe-biden-news/judge-temporarily-blocks-south-carolina-from-imposing-restrictive-heartbeat-ban-abortion-law","en","False","","1","New York Times","http://nytimes.com"
