stories_id,publish_date,title,url,language,ap_syndicated,themes,media_id,media_name,media_url
"1839212846","2021-02-01 12:20:58","Reddit C.E.O. on GameStop and the Forum Shaking Up Wall Street","https://www.nytimes.com/2021/02/01/opinion/sway-kara-swisher-steve-huffman.html","en","False","","1","New York Times","http://nytimes.com"
"1839212842","2021-02-01 15:43:16","Major Storm Hits the Northeast and Disrupts Travel for Millions","https://www.nytimes.com/live/2021/02/01/us/winter-storm-snow/","en","False","","1","New York Times","http://nytimes.com"
"1839330344","2021-02-01 16:53:15","Court tosses a Trump-era rule limiting science in studies for public health regulations.","https://www.nytimes.com/live/2021/02/01/us/biden-administration/court-tosses-a-trump-era-rule-limiting-science-in-studies-for-public-health-regulations","en","False","","1","New York Times","http://nytimes.com"
"1839006935","2021-02-01 12:47:21","Republicans, Speak Out Against Marjorie Taylor Greene","https://www.nytimes.com/2021/02/01/opinion/letters/marjorie-taylor-greene-republicans.html","en","False","","1","New York Times","http://nytimes.com"
"1838960994","2021-02-01 11:50:52","Silver jumps as retail traders find a new target to squeeze, but its early gains fade.","https://www.nytimes.com/live/2021/02/01/business/us-economy-coronavirus/silver-jumps-as-retail-traders-find-a-new-target-to-squeeze-but-its-early-gains-fade","en","False","","1","New York Times","http://nytimes.com"
"1838784562","2021-02-01 05:00:14","Raise Your Hand if You Were Expecting Biden to Be a Revolutionary","https://www.nytimes.com/2021/02/01/opinion/biden-executive-orders-mcconnell.html","en","False","","1","New York Times","http://nytimes.com"
"1838784543","2021-02-01 05:00:14","The Government Agencies That Became Smaller, and Unhappier, Under Trump","https://www.nytimes.com/2021/02/01/upshot/trump-effect-government-agencies.html","en","False","","1","New York Times","http://nytimes.com"
"1838783957","2021-02-01 07:27:24","Science of the storm: Rising Arctic temperatures bring wild weather around the world.","https://www.nytimes.com/live/2021/02/01/us/winter-storm-snow/science-of-the-storm-rising-arctic-temperatures-bring-wild-weather-around-the-world","en","False","","1","New York Times","http://nytimes.com"
"1838784025","2021-02-01 07:00:03","Biden’s Approval Rating Is Trump’s in Reverse","https://www.nytimes.com/2021/02/01/us/politics/biden-approval-rating-trump.html","en","False","","1","New York Times","http://nytimes.com"
"1839425313","2021-02-01 05:00:13","How Climate Change May Affect Your Health","https://www.nytimes.com/2021/02/01/well/eat/climate-change-health.html","en","False","","1","New York Times","http://nytimes.com"
"1839429028","2021-02-01 09:25:52","Two Biden Priorities, Climate and Inequality, Meet on Black-Owned Farms","https://www.nytimes.com/2021/01/31/climate/black-farmers-discrimination-agriculture.html","en","False","","1","New York Times","http://nytimes.com"
"1839504642","2021-02-01 18:41:42","Our Eighth Annual Student Editorial Contest","https://www.nytimes.com/2021/02/01/learning/our-eighth-annual-student-editorial-contest.html","en","False","","1","New York Times","http://nytimes.com"
"1839559323","2021-02-01 19:32:11","Biden to Free Up Billions in Delayed Puerto Rico Storm Aid","https://www.nytimes.com/2021/02/01/climate/puerto-rico-maria-federal-aid.html","en","False","","1","New York Times","http://nytimes.com"
"1839895018","2021-02-02 03:52:05","First Came the Lockdown. Then Came the Wildfire.","https://www.nytimes.com/2021/02/02/world/australia/perth-wooroloo-fire-covid.html","en","False","","1","New York Times","http://nytimes.com"
"1839983402","2021-02-02 05:00:13","G.M. and the Electric-Car Comeback","https://www.nytimes.com/2021/02/02/opinion/GM-electric-cars.html","en","False","","1","New York Times","http://nytimes.com"
"1839983386","2021-02-02 05:00:18","A Consensus Builder for E.P.A. When Some Want a Fighter","https://www.nytimes.com/2021/02/02/climate/biden-epa.html","en","False","","1","New York Times","http://nytimes.com"
"1840003522","2021-02-02 06:00:05","Assessing Biden’s Climate Plan","https://www.nytimes.com/2021/02/02/podcasts/the-daily/biden-climate-agenda.html","","False","","1","New York Times","http://nytimes.com"
"1840037451","2021-02-02 06:29:03","Blue vs. Red Economic Records","https://www.nytimes.com/2021/02/02/briefing/myanmar-coup-mcconnell-evan-rachel-wood-marylin-manson.html","en","False","","1","New York Times","http://nytimes.com"
"1840254410","2021-02-02 10:17:11","GameStop and AMC plunge as the retail trading frenzy loses steam.","https://www.nytimes.com/live/2021/02/02/business/stock-market-today/gamestop-and-amc-plunge-as-the-retail-trading-frenzy-loses-steam","en","False","","1","New York Times","http://nytimes.com"
"1840413229","2021-02-02 13:00:08","Biden's Plan to Uncouple the Democrats From Corporations","https://www.nytimes.com/2021/02/02/opinion/biden-regulation-corporations-gensler-chopra.html","en","False","","1","New York Times","http://nytimes.com"
"1840413212","2021-02-02 13:17:15","The Senate confirms Pete Buttigieg as transportation secretary.","https://www.nytimes.com/live/2021/01/28/us/biden-trump-impeachment/pete-buttigieg-transportation-secretary","en","False","","1","New York Times","http://nytimes.com"
"1840501910","2021-02-02 14:42:31","Your Wednesday Briefing","https://www.nytimes.com/2021/02/02/briefing/myanmar-sanctions-russia-vaccine-results-alibaba.html","en","False","","1","New York Times","http://nytimes.com"
"1840517707","2021-02-02 15:04:38","Pete Buttigieg Is Confirmed as Biden’s Transportation Secretary","https://www.nytimes.com/2021/02/02/us/politics/pete-buttigieg-confirmed-transportation-secretary.html","en","False","","1","New York Times","http://nytimes.com"
"1840590245","2021-02-02 16:36:34","After a Bruising Year, the Oil Industry Confronts a Diminished Future","https://www.nytimes.com/2021/02/02/business/energy-environment/exxon-mobil-bp-2020-loss.html","en","False","","1","New York Times","http://nytimes.com"
"1840590231","2021-02-02 16:52:02","Automakers Drop Efforts to Derail California Climate Rules","https://www.nytimes.com/2021/02/02/climate/automakers-climate-change.html","en","False","","1","New York Times","http://nytimes.com"
"1840634507","2021-02-02 17:40:09","Nature Doesn’t Get a Paycheck. Now, There’s a Movement to Change That.","https://www.nytimes.com/2021/02/02/climate/dasgupta-report-biodiversity-climate.html","en","False","","1","New York Times","http://nytimes.com"
"1840739838","2021-02-02 21:13:14","How Hong Kong’s Lowliest Politicians Became Its Champions of Freedom","https://www.nytimes.com/2021/02/02/world/asia/hong-kong-democracy-councilors.html","en","False","","1","New York Times","http://nytimes.com"
"1840791412","2021-02-02 22:21:29","Corrections: Feb. 3, 2021","https://www.nytimes.com/2021/02/02/pageoneplus/corrections-feb-3-2021.html","en","False","","1","New York Times","http://nytimes.com"
"1841108684","2021-02-03 05:00:13","Rebuild or Leave ‘Paradise’: Climate Change Dilemma Facing a Nicaraguan Coastal Town","https://www.nytimes.com/video/world/americas/100000007494833/nicaragua-hurricane-eta-iota.html","en","False","","1","New York Times","http://nytimes.com"
"1841108680","2021-02-03 05:00:15","Coastal Nicaragua Towns Face a Climate-Change Dilemma After Double Hurricanes Hit","https://www.nytimes.com/2021/02/03/world/nicaragua-hurricane-eta-iota-video.html","en","False","","1","New York Times","http://nytimes.com"
"1841139044","2021-02-03 06:00:09","The Year-Round Garden","https://www.nytimes.com/2021/02/03/realestate/the-year-round-garden.html","en","False","","1","New York Times","http://nytimes.com"
"1841181731","2021-02-03 07:01:34","How Trump’s Defense Is Coming Together","https://www.nytimes.com/2021/02/03/us/politics/trump-impeachment-defense-republicans.html","en","False","","1","New York Times","http://nytimes.com"
"1841291465","2021-02-03 08:50:00","Court Faults France Over ‘Ecological Damage’ From Its Emissions Levels","https://www.nytimes.com/2021/02/03/world/europe/france-emissions-court.html","en","False","","1","New York Times","http://nytimes.com"
"1841530521","2021-02-03 12:36:11","Daimler plans to split its car and truck businesses as it moves away from internal combustion.","https://www.nytimes.com/live/2021/02/03/business/stock-market-today/daimler-plans-to-split-its-car-and-truck-businesses-as-it-moves-away-from-internal-combustion","en","False","","1","New York Times","http://nytimes.com"
"1841545273","2021-02-03 13:24:58","The Shift Toward Clean Cars","https://www.nytimes.com/2021/02/03/climate/electric-vehicles.html","en","False","","1","New York Times","http://nytimes.com"
"1841672498","2021-02-03 15:35:01","A poll shows most Americans, including many Republicans, support $1,400 stimulus checks.","https://www.nytimes.com/live/2021/02/03/us/biden-administration/a-poll-shows-most-americans-including-many-republicans-support-1400-stimulus-checks","en","False","","1","New York Times","http://nytimes.com"
"1841685820","2021-02-03 15:35:02","Stimulus Check Poll: Most Americans, Including Many Republicans, Support $1,400 Aid","https://www.nytimes.com/2021/02/03/us/stimulus-check-polls.html","en","False","","1","New York Times","http://nytimes.com"
"1841689675","2021-02-03 16:21:42","Biden’s pick to run the E.P.A. tells lawmakers he will ‘move with a sense of urgency’ on climate change.","https://www.nytimes.com/live/2021/02/03/us/biden-administration/bidens-pick-to-run-the-epa-tells-lawmakers-he-will-move-with-a-sense-of-urgency-on-climate-change","en","False","","1","New York Times","http://nytimes.com"
"1841712591","2021-02-03 16:51:53","Miguel Cardona, education secretary nominee, tells senators schools need more funds to recover.","https://www.nytimes.com/live/2021/02/03/us/biden-administration/miguel-cardona-education-secretary-nominee-tells-senators-schools-need-more-funds-to-recover","en","False","","1","New York Times","http://nytimes.com"
"1841768134","2021-02-03 18:03:59","Jim Justice, a G.O.P. Governor, on Why Biden Needs to ‘Go Big’ on Covid Aid","https://www.nytimes.com/2021/02/03/us/politics/jim-justice-manchin-west-virginia.html","en","False","","1","New York Times","http://nytimes.com"
"1841802566","2021-01-28 00:00:00","Biden Signs Orders Aimed at Expanding Health Care - The New York Times","https://www.nytimes.com/live/2021/01/28/us/biden-trump-impeachment#inside-the-white-house-strict-rules-aim-to-slow-the-spread-of-the-coronavirus","en","False","","1","New York Times","http://nytimes.com"
"1841968540","2021-01-26 00:00:00","The Battle Lines Are Forming in Biden’s Climate Push - The New York Times","https://www.nytimes.com/2021/01/26/climate/biden-climate-change.html?action=click&amp;module=Spotlight&amp;pgtype=Homepage","en","False","","1","New York Times","http://nytimes.com"
"1841985290","2021-01-22 00:00:00","Senate Leaders Strike Deal to Delay Trump’s Impeachment Trial - The New York Times","https://www.nytimes.com/live/2021/01/22/us/joe-biden?action=click&amp;module=Top%20Stories&amp;pgtype=Homepage#national-guard-parking-garage","en","False","","1","New York Times","http://nytimes.com"
"1842111801","2021-02-04 03:11:27","With French Theaters Closed, Puppetry Takes Center Stage","https://www.nytimes.com/2021/02/04/theater/puppetry-theater-france.html","en","False","","1","New York Times","http://nytimes.com"
"1842214285","2021-02-04 05:00:02","We Live in Disastrous Times. Why Can’t Disaster Movies Evolve?","https://www.nytimes.com/2021/02/04/magazine/george-clooney-midnight-sky.html","en","False","","1","New York Times","http://nytimes.com"
"1842234146","2021-02-04 05:00:11","Are GameStop’s ‘Degenerates’ Just Getting Started?","https://www.nytimes.com/2021/02/04/opinion/gamestock-stock-market-populism.html","en","False","","1","New York Times","http://nytimes.com"
"1842375543","2021-02-04 08:00:34","Regualtors Focus on Potential Manipulation Behind Meme Stocks","https://www.nytimes.com/2021/02/04/business/dealbook/meme-stocks-regulators.html","en","False","","1","New York Times","http://nytimes.com"
"1842471445","2021-02-04 09:59:22","Got Climate Anxiety? These People Are Doing Something About It","https://www.nytimes.com/2021/02/04/climate/climate-anxiety-stress.html","en","False","","1","New York Times","http://nytimes.com"
"1842659087","2021-02-04 13:05:39","Biden to announce the end of U.S. support to Saudi war in Yemen and a freeze on troop withdrawals from Germany.","https://www.nytimes.com/live/2021/02/04/us/joe-biden-trump-impeachment/biden-to-announce-the-end-of-us-support-to-saudi-war-in-yemen-and-a-freeze-on-troop-withdrawals-from-germany","en","False","","1","New York Times","http://nytimes.com"
"1842734506","2021-02-04 14:13:45","Senate braces for marathon ‘Vote-a-Rama,’ as Democrats press forward with Biden’s $1.9 trillion stimulus plan.","https://www.nytimes.com/live/2021/02/04/us/joe-biden-trump-impeachment/senate-braces-for-marathon-vote-a-rama-as-democrats-press-forward-with-bidens-1-9-trillion-stimulus-plan","en","False","","1","New York Times","http://nytimes.com"
"1842788372","2021-02-04 15:19:41","Your Friday Briefing","https://www.nytimes.com/2021/02/04/briefing/vaccines-yemen-biden-climate-change.html","en","False","","1","New York Times","http://nytimes.com"
"1842814064","2021-02-04 15:50:06","The Ageism and Ableism Driving the Vaccine Rollout Is Deadly","https://www.nytimes.com/2021/02/04/opinion/covid-vaccine-ableism.html","en","False","","1","New York Times","http://nytimes.com"
"1842835904","2021-02-04 16:28:57","Trump’s lawyers reject a request from House managers for testimony from the former president.","https://www.nytimes.com/live/2021/02/04/us/joe-biden-trump-impeachment/trumps-lawyers-reject-a-request-from-house-managers-for-testimony-from-the-former-president","en","False","","1","New York Times","http://nytimes.com"
"1842865658","2021-02-04 16:54:38","Film Club: ‘Rebuild or Leave “Paradise”: Climate Change Dilemma Facing a Nicaraguan Coastal Town’","https://www.nytimes.com/2021/02/04/learning/film-club-rebuild-or-leave-paradise-climate-change-dilemma-facing-a-nicaraguan-coastal-town.html","en","False","","1","New York Times","http://nytimes.com"
"1842885952","2021-02-04 16:55:30","Biden’s Policies Are Popular. What Does That Mean for Republicans?","https://www.nytimes.com/2021/02/04/us/politics/biden-approval-rating-republicans.html","en","False","","1","New York Times","http://nytimes.com"
"1842885938","2021-02-04 17:23:31","The Senate Intelligence Committee will examine anti-government extremists.","https://www.nytimes.com/live/2021/02/04/us/joe-biden-trump-impeachment/the-senate-intelligence-committee-will-examine-anti-government-extremists","en","False","","1","New York Times","http://nytimes.com"
"1842885937","2021-02-04 17:23:59","Paul Crutzen, Nobel Laureate Who Fought Climate Change, Dies at 87","https://www.nytimes.com/2021/02/04/science/paul-crutzen-dead.html","en","False","","1","New York Times","http://nytimes.com"
"1842925300","2021-02-04 18:00:04","What’s Happening to Our Economy Is Like a Natural Disaster","https://www.nytimes.com/2021/02/04/podcasts/ezra-klein-podcast-paul-krugman-transcript.html","en","False","","1","New York Times","http://nytimes.com"
"1842948205","2021-02-04 18:58:57","Marjorie Taylor Greene, Climate Anxiety, Applejack: Your Thursday Evening Briefing","https://www.nytimes.com/2021/02/04/briefing/marjorie-taylor-greene-climate-anxiety-applejack.html","en","False","","1","New York Times","http://nytimes.com"
"1843273156","2021-02-05 03:43:44","Pacific Islands’ Most Important Megaphone Falls Into Discord","https://www.nytimes.com/2021/02/05/world/asia/pacific-islands-forum.html","en","False","","1","New York Times","http://nytimes.com"
"1843323162","2021-02-05 05:00:19","The Economist Placing Value on Black Women’s Overlooked Work","https://www.nytimes.com/2021/02/05/business/black-women-economists-nina-banks.html","en","False","","1","New York Times","http://nytimes.com"
"1843348743","2021-02-05 05:00:12","Myanmar Needs a New Kind of Democracy","https://www.nytimes.com/2021/02/05/opinion/myanmar-coup.html","en","False","","1","New York Times","http://nytimes.com"
"1843348701","2021-02-05 05:07:34","What Working in the Oil Industry Taught Me","https://www.nytimes.com/2021/02/05/opinion/fossil-fuel-oil-climate-change.html","en","False","","1","New York Times","http://nytimes.com"
"1843536337","2021-02-05 08:58:26","Biden set to speak on the state of the economy on Friday as Democrats press ahead with his relief package.","https://www.nytimes.com/live/2021/02/05/us/joe-biden-trump-impeachment/biden-set-to-speak-on-the-state-of-the-economy-on-friday-as-democrats-press-ahead-with-his-relief-package","en","False","","1","New York Times","http://nytimes.com"
"1843536333","2021-02-05 08:35:43","Take a Visual Tour Through California as It Reopens","https://www.nytimes.com/2021/02/05/us/california-reopening-coronavirus.html","en","False","","1","New York Times","http://nytimes.com"
"1843599402","2021-02-05 09:40:34","The Senate advances a budget plan including Biden’s $1.9 trillion stimulus, over unified Republican opposition.","https://www.nytimes.com/live/2021/02/05/us/joe-biden-trump-impeachment/the-senate-advances-a-budget-plan-including-bidens-1-9-trillion-stimulus-over-unified-republican-opposition","en","False","","1","New York Times","http://nytimes.com"
"1843616347","2021-01-27 00:00:00","President Biden to Sign Executive Order, Pausing Oil and Gas Leasing - The New York Times","https://www.nytimes.com/2021/01/27/climate/biden-climate-executive-orders.html?smid=tw-nytimes&amp;smtyp=cur","en","False","","1","New York Times","http://nytimes.com"
"1843630545","2021-02-05 10:20:59","What Does Climate Change Sound Like?","https://www.nytimes.com/2021/02/05/podcasts/climate-change-podcast-sound.html","en","False","","1","New York Times","http://nytimes.com"
"1843670653","2021-01-28 10:00:01","Opinion | Every Country Has Its Own Climate Risks. What’s Yours? - The New York Times","https://www.nytimes.com/interactive/2021/01/28/opinion/climate-change-risks-by-country.html?action=click&module=Opinion&pgtype=Homepage","en","False","","1","New York Times","http://nytimes.com"
"1843887683","2021-02-05 15:25:02","Trevor Bauer Picks Dodgers Over Mets","https://www.nytimes.com/2021/02/05/sports/baseball/trevor-bauer-dodgers-mets.html","en","False","","1","New York Times","http://nytimes.com"
"1844490523","2021-02-06 05:00:11","Watch This Billion-Year Journey of Earth’s Tectonic Plates","https://www.nytimes.com/2021/02/06/science/tectonic-plates-continental-drift.html","en","False","","1","New York Times","http://nytimes.com"
"1844599022","2021-02-06 11:00:07","This Climate Deal Is Good for Earth and the Economy","https://www.nytimes.com/2021/02/06/opinion/climate-treaty-kigali-amendment.html","en","False","","1","New York Times","http://nytimes.com"
"1844599020","2021-02-06 11:00:07","Invasive Insects and Diseases Are Killing Our Forests","https://www.nytimes.com/2021/02/06/opinion/epidemic-invasive-species-trees.html","en","False","","1","New York Times","http://nytimes.com"
"1844599019","2021-02-06 11:30:48","The Task Ahead for Biden on Climate","https://www.nytimes.com/2021/02/06/opinion/biden-climate-change-environment.html","en","False","","1","New York Times","http://nytimes.com"
"1844599015","2021-02-06 11:09:29","For Buttigieg, ‘Generational’ Transportation Change May Not Be Easy, Experts Say","https://www.nytimes.com/2021/02/06/us/politics/pete-buttigieg-transportation.html","en","False","","1","New York Times","http://nytimes.com"
"1845083779","2021-02-07 05:00:10","‘The Pressure Is On’: Will Schumer Satisfy the Left?","https://www.nytimes.com/2021/02/07/us/politics/schumer-impeachment-new-york.html","en","False","","1","New York Times","http://nytimes.com"
"1845135524","2021-02-07 06:14:13","Glacier Bursts in India, Leaving 150 Missing in Floods","https://www.nytimes.com/2021/02/07/world/asia/india-glacier-flood-uttarakhand.html","en","False","","1","New York Times","http://nytimes.com"
"1845354377","2021-02-07 12:02:30","Yellen Warns Jobs Will be Slow to Rebound Without Stimulus","https://www.nytimes.com/2021/02/07/us/yellen-economy.html","en","False","","1","New York Times","http://nytimes.com"
"1845362607","2021-02-07 13:18:09","To fight the virus, France relaxes its ban on an American habit: lunch at your desk.","https://www.nytimes.com/live/2021/02/07/world/covid-19-coronavirus/to-fight-the-virus-france-relaxes-its-ban-on-an-american-habit-lunch-at-your-desk","en","False","","1","New York Times","http://nytimes.com"
"1845635087","2021-02-07 23:22:38","Biden Administration Moves to Rejoin U.N. Human Rights Council","https://www.nytimes.com/2021/02/07/us/politics/human-rights-council-biden-administration.html","en","False","","1","New York Times","http://nytimes.com"
"1845877173","2021-02-08 05:00:03","Electrons, Photons, Gluons, Quarks: A Nobel-Winning Physicist Explains It All","https://www.nytimes.com/2021/02/08/books/review/frank-wilczek-fundamentals.html","en","False","","1","New York Times","http://nytimes.com"
"1845896533","2021-02-08 05:00:15","Coal-Fired Power Took a Beating During the Pandemic, Study Finds","https://www.nytimes.com/2021/02/08/climate/coal-climate-change.html","en","False","","1","New York Times","http://nytimes.com"
"1846277435","2021-02-08 12:46:28","The Auto Revolution Is Here","https://www.nytimes.com/2021/02/08/technology/the-auto-revolution-is-here.html","en","False","","1","New York Times","http://nytimes.com"
"1846277426","2021-02-08 12:38:09","A Georgia clinic that started vaccinating teachers had its supply cut off by the state.","https://www.nytimes.com/live/2021/02/07/world/covid-19-coronavirus/a-georgia-clinic-that-started-vaccinating-teachers-had-its-supply-cut-off-by-the-state","en","False","","1","New York Times","http://nytimes.com"
"1846366757","2021-02-08 14:51:53","Before Himalayan Flood, India Ignored Warnings of Development Risks","https://www.nytimes.com/2021/02/08/world/asia/india-flood-ignored-warnings.html","en","False","","1","New York Times","http://nytimes.com"
"1846366754","2021-02-08 15:00:07","Achoo! Climate Change Lengthening Pollen Season in U.S., Study Shows","https://www.nytimes.com/2021/02/08/climate/climate-change-pollen-hay-fever.html","en","False","","1","New York Times","http://nytimes.com"
"1846401441","2021-02-08 16:00:44","Paris Opera to Act on Racist Stereotypes in Ballet","https://www.nytimes.com/2021/02/08/arts/dance/paris-ballet-diversity.html","en","False","","1","New York Times","http://nytimes.com"
"1846501791","2021-02-08 18:19:10","Impeachment Trial, Child Tax Credit, Bitcoin: Your Monday Evening Briefing","https://www.nytimes.com/2021/02/08/briefing/impeachment-trial-child-tax-credit-bitcoin.html","en","False","","1","New York Times","http://nytimes.com"
"1846501763","2021-02-08 18:36:23","A Flash Flood Pushed Forward by Climate Change","https://www.nytimes.com/2021/02/08/climate/climate-change-flash-flood-india.html","en","False","","1","New York Times","http://nytimes.com"
"1846531128","2021-02-08 19:00:06","How Democrats Learned to Seize the Day","https://www.nytimes.com/2021/02/08/opinion/democrats-covid-stimulus.html","en","False","","1","New York Times","http://nytimes.com"
"1846852168","2021-02-09 05:00:16","Should We Dim the Sun? Will We Even Have a Choice?","https://www.nytimes.com/2021/02/09/opinion/ezra-klein-podcast-elizabeth-kolbert.html","en","False","","1","New York Times","http://nytimes.com"
"1846852162","2021-02-09 05:00:19","How Biden United a Fractious Party Under One Tent","https://www.nytimes.com/2021/02/09/us/politics/biden-democrats-bernie-sanders-liberals.html","en","False","","1","New York Times","http://nytimes.com"
"1847022359","2021-02-09 07:39:32","Bitcoin Has a Big Day, Thanks to Tesla","https://www.nytimes.com/2021/02/09/business/dealbook/cryptocurrency-bitcoin-tesla.html","en","False","","1","New York Times","http://nytimes.com"
"1847369789","2021-02-09 14:26:36","Exploring Race and Resistance for Young Audiences","https://www.nytimes.com/2021/02/09/theater/black-history-month-kids.html","en","False","","1","New York Times","http://nytimes.com"
"1847398641","2021-02-09 15:00:06","After Amazon, What’s Next for Jeff Bezos?","https://www.nytimes.com/2021/02/09/opinion/jeff-bezos-next-act.html","en","False","","1","New York Times","http://nytimes.com"
"1847440617","2021-02-09 15:46:23","Electric Cars and a Cleaner Energy Future","https://www.nytimes.com/2021/02/09/opinion/letters/electric-cars.html","en","False","","1","New York Times","http://nytimes.com"
"1847695312","2021-02-10 00:00:11","China’s Mars Mission Is Up Next to Orbit the Red Planet","https://www.nytimes.com/2021/02/10/science/china-mars-mission.html","en","False","","1","New York Times","http://nytimes.com"
"1847925201","2021-02-10 05:00:00","Book Review: ‘Under a White Sky,’ by Elizabeth Kolbert","https://www.nytimes.com/2021/02/10/books/review-under-white-sky-elizabeth-kolbert.html","en","False","","1","New York Times","http://nytimes.com"
"1847925191","2021-02-10 05:00:11","From the Archives: Climate Change and Free College for All","https://www.nytimes.com/2021/02/10/opinion/the-argument-climate-change-free-college.html","en","False","","1","New York Times","http://nytimes.com"
"1848224069","2021-02-10 11:07:53","China’s Emissions of Ozone-Harming Gas Are Declining, Studies Find","https://www.nytimes.com/2021/02/10/climate/ozone-layer-china-cfcs.html","en","False","","1","New York Times","http://nytimes.com"
